movieId,sinopsis,rating
1,"Led by Woody, Andy's toys live happily in his room until Andy's birthday brings Buzz Lightyear onto the scene. Afraid of losing his place in Andy's heart, Woody plots against Buzz. But when circumstances separate Buzz and Woody from their owner, the duo eventually learns to put aside their differences.",80
3,"A family wedding reignites the ancient feud between next-door neighbors and fishing buddies John and Max. Meanwhile, a sultry Italian divorcée opens a restaurant at the local bait shop, alarming the locals who worry she'll scare the fish away. But she's less interested in seafood than she is in cooking up a hot time with Max.",64
4,"Cheated on, mistreated and stepped on, the women are holding their breath, waiting for the elusive ""good man"" to break a string of less-than-stellar lovers. Friends and confidants Vannah, Bernie, Glo and Robin talk it all out, determined to find a better way to breathe.",63
5,"Just when George Banks has recovered from his daughter's wedding, he receives the news that she's pregnant ... and that George's wife is expecting too. He was planning on selling their home, but that's a plan that—like George—will have to change with the arrival of both a grandchild and a kid of his own.",62
6,Obsessive master thief Neil McCauley leads a top-notch crew on various daring heists throughout Los Angeles while determined detective Vincent Hanna pursues him without rest. Each man recognizes and respects the ability and the dedication of the other even though they are aware their cat-and-mouse game may end in violence.,79
7,"An ugly duckling having undergone a remarkable change, still harbors feelings for her crush: a carefree playboy, but not before his business-focused brother has something to say about it.",62
7,"An ugly duckling having undergone a remarkable change, still harbors feelings for her crush: a carefree playboy, but not before his business-focused brother has something to say about it.",62
8,"A mischievous young boy, Tom Sawyer, witnesses a murder by the deadly Injun Joe. Tom becomes friends with Huckleberry Finn, a boy with no future and no family. Tom has to choose between honoring a friendship or honoring an oath because the town alcoholic is accused of the murder. Tom and Huck go through several adventures trying to retrieve evidence.",53
9,When a man's daughter is suddenly taken during a championship hockey game – with the captors demanding a billion dollars by game's end – he frantically sets a plan in motion to rescue her and abort an impending explosion before the final buzzer.,59
10,"When a powerful satellite system falls into the hands of Alec Trevelyan, AKA Agent 006, a former ally-turned-enemy, only James Bond can save the world from a dangerous space weapon that -- in one short pulse -- could destroy the earth! As Bond squares off against his former compatriot, he also battles Xenia Onatopp, an assassin who uses pleasure as her ultimate weapon",69
11,"Widowed U.S. president Andrew Shepherd, one of the world's most powerful men, can have anything he wants -- and what he covets most is Sydney Ellen Wade, a Washington lobbyist. But Shepherd's attempts at courting her spark wild rumors and decimate his approval ratings.",66
12,"When a lawyer shows up at the vampire's doorstep, he falls prey to his charms and joins him in his search for fresh blood. Enter Professor Van Helsing, who may be the only one able to vanquish the Count.",60
13,"An outcast half-wolf risks his life to prevent a deadly epidemic from ravaging Nome, Alaska.",73
16,"In early-1970s Las Vegas, Sam ""Ace"" Rothstein gets tapped by his bosses to head the Tangiers Casino. At first, he's a great success in the job, but over the years, problems with his loose-cannon enforcer Nicky Santoro, his ex-hustler wife Ginger, her con-artist ex Lester Diamond and a handful of corrupt politicians put Sam in ever-increasing danger.",80
17,"Based on Jane Austen's classic novel of the Dashwood sisters, sensible Elinor and passionate Marianne, whose chances at marriage seem doomed by their family's sudden loss of fortune.  When Henry Dashwood dies unexpectedly, his estate must pass on by law to his son from his first marriage, John and wife Fanny. But these circumstances leave Mr. Dashwood's current wife, and daughters Elinor, Marianne and Margaret, without a home and with barely enough money to live on. As Elinor and Marianne struggle to find romantic fulfillment in a society obsessed with financial and social status, they must learn to mix sense with sensibility in their dealings with both money and men.",75
18,It's Ted the Bellhop's first night on the job...and the hotel's very unusual guests are about to place him in some outrageous predicaments. It seems that this evening's room service is serving up one unbelievable happening after another.,57
19,"Summoned from an ashram in Tibet, Ace finds himself on a perilous journey into the jungles of Africa to find Shikaka, the missing sacred animal of the friendly Wachati tribe. He must accomplish this before the wedding of the Wachati's Princess to the prince of the warrior Wachootoos. If Ace fails, the result will be a vicious tribal war.",63
20,"When a vengeful New York transit cop decides to steal a trainload of subway fares, his foster brother—a fellow cop—tries to protect him.",59
21,"Chili Palmer is a Miami mobster who gets sent by his boss, the psychopathic ""Bones"" Barboni, to collect a bad debt from Harry Zimm, a Hollywood producer who specializes in cheesy horror films. When Chili meets Harry's leading lady, the romantic sparks fly. After pitching his own life story as a movie idea, Chili learns that being a mobster and being a Hollywood producer really aren't all that different.",65
22,An agoraphobic psychologist and a female detective must work together to take down a serial killer who copies serial killers from the past.,65
23,"Assassin Robert Rath arrives at a funeral to kill a prominent mobster, only to witness a rival hired gun complete the job for him -- with grisly results. Horrified by the murder of innocent bystanders, Rath decides to take one last job and then return to civilian life. But finding his way out of the world of contract killing grows ever more dangerous as Rath falls for his female target and becomes a marked man himself.",65
24,"Harassed by classmates who won't accept his shocking appearance, a shy young man known as ""Powder"" struggles to fit in. But the cruel taunts stop when Powder displays a mysterious power that allows him to do incredible things. This phenomenon changes the lives of all those around him in ways they never could have imagined.",69
25,"Ben Sanderson, an alcoholic Hollywood screenwriter who lost everything because of his drinking, arrives in Las Vegas to drink himself to death. There, he meets and forms an uneasy friendship and non-interference pact with prostitute Sera.",73
26,The evil Iago pretends to be friend of Othello in order to manipulate him to serve his own end in the film version of this Shakespeare classic.,66
27,"Waxing nostalgic about the bittersweet passage from childhood to puberty in this tender coming-of-age tale, four childhood girlfriends -- Teeny, Chrissy, Samantha and Roberta -- recall the magical summer of 1970. During their walk down memory lane, they reconcile experiences with boys, secrets, bullies and more.",69
28,"Anne Elliot, the daughter of a financially troubled aristocratic family, is persuaded to break her engagement to Frederick Wentworth, a young sea captain of meager means. Years later, money troubles force Anne's father to rent out the family estate to Admiral Croft, and Anne is again thrown into company with Frederick -- who is now rich, successful, and perhaps still in love with Anne.",71
28,"Anne Elliot, the daughter of a financially troubled aristocratic family, is persuaded to break her engagement to Frederick Wentworth, a young sea captain of meager means. Years later, money troubles force Anne's father to rent out the family estate to Admiral Croft, and Anne is again thrown into company with Frederick -- who is now rich, successful, and perhaps still in love with Anne.",71
29,"A scientist in a surrealist society kidnaps children to steal their dreams, hoping that they slow his aging process.",73
32,"In the year 2035, convict James Cole reluctantly volunteers to be sent back in time to discover the origin of a deadly virus that wiped out nearly all of the earth's population and forced the survivors into underground communities. But when Cole is mistakenly sent to 1990 instead of 1996, he's arrested and locked up in a mental hospital. There he meets psychiatrist Dr. Kathryn Railly, and patient Jeffrey Goines, the son of a famous virus expert, who may hold the key to the mysterious rogue group, the Army of the 12 Monkeys, thought to be responsible for unleashing the killer disease.",76
34,"Babe is a little pig who doesn't quite know his place in the world. With a bunch of odd friends, like Ferdinand the duck who thinks he is a rooster and Fly the dog he calls mum, Babe realises that he has the makings to become the greatest sheep pig of all time, and Farmer Hogget knows it. With the help of the sheep dogs, Babe learns that a pig can be anything that he wants to be.",62
36,A death row inmate turns for spiritual guidance to a local nun in the days leading up to his scheduled execution for the murders of a young couple.,74
38,"Identical 9-year-olds from very different backgrounds: orphaned Amanda and wealthy Alyssa meet at summer camp and decide to switch places -- and play matchmaker between Alyssa's dad, Roger, and the kind social worker who cares for Amanda.",65
39,"Shallow, rich and socially successful Cher is at the top of her Beverly Hills high school's pecking scale. Seeing herself as a matchmaker, Cher first coaxes two teachers into dating each other. Emboldened by her success, she decides to give hopelessly klutzy new student Tai a makeover. When Tai becomes more popular than she is, Cher realizes that her disapproving ex-stepbrother was right about how misguided she was -- and falls for him.",73
40,A South-African preacher goes to search for his wayward son who has committed a crime in the big city.,67
41,"A murderous lust for the British throne sees Richard III descend into madness. Though the setting is transposed to the 1930s, England is torn by civil war, split between the rivaling houses of York and Lancaster. Richard aspires to a fascist dictatorship, but must first remove the obstacles to his ascension—among them his brother, his nephews and his brother's wife. When the Duke of Buckingham deserts him, Richard's plans are compromised.",68
42,On the streets they call cash dead presidents. And that's just what a Vietnam veteran is after when he returns home from the war only to find himself drawn into a life of crime. With the aid of his fellow vets he plans the ultimate heist -- a daring robbery of an armored car filled with unmarked U.S. currency!,67
43,"An aspiring young physician, Robert Merivel found himself in the service of King Charles II and saves the life of someone close to the King. Merivel joins the King's court and lives the high life provided to someone of his position. Merivel is ordered to marry his King's mistress in order to divert the queens suspicions. He is given one order by the king and that is not to fall in love. The situation worsens when Merivel finds himself in love with his new wife. Eventually, the King finds out and relieves Merivel of his position and wealth. His fall from grace leaves Merivel where he first started. And through his travels and reunions with an old friend, he rediscovers his love for true medicine and what it really means to be a physician.",63
44,"For nine generations an evil sorcerer has been victorious in hand-to-hand battle against his mortal enemies. If he wins a tenth Mortal Kombat tournament, desolation and evil will reign over the multiverse forever. To save Earth, three warriors must overcome seemingly insurmountable odds, their own inner demons, and superhuman foes in this action/adventure movie based on one of the most popular video games of all time.",58
45,"Suzanne Stone wants to be a world-famous news anchor and she is willing to do anything to get what she wants. What she lacks in intelligence, she makes up for in cold determination and diabolical wiles. As she pursues her goal with relentless focus, she is forced to destroy anything and anyone that may stand in her way, regardless of the ultimate cost or means necessary.",66
46,"Soon-to-be-wed graduate student Finn Dodd develops cold feet when she suspects her fiancé is cheating on her. In order to clear her head, Finn visits her grandmother, Hy, and great aunt, Glady Joe Cleary, in Grasse, Calif. There, Finn learns that Hy and Glady Joe are members of a group of passionate quilters, and over the course of her visit she is regaled with tales of love and life by women who have collected rich experiences and much wisdom.",64
47,"Two homicide detectives are on a desperate hunt for a serial killer whose crimes are based on the ""seven deadly sins"" in this dark and haunting film that takes viewers from the tortured remains of one victim to the next. The seasoned Det. Sommerset researches each sin in an effort to get inside the killer's mind, while his novice partner, Mills, scoffs at his efforts to unravel the case.",84
48,"Pocahontas, daughter of a Native American tribe chief, falls in love with an English soldier as colonists invade 17th century Virginia.",69
49,"A prudish woman working on tenure as a literacy professor at a large urban university finds herself attracted to a free-spirited, liberal woman who works at a local carnival.",61
50,"Held in an L.A. interrogation room, Verbal Kint attempts to convince the feds that a mythic crime lord, Keyser Soze, not only exists, but was also responsible for drawing him and his four partners into a multi-million dollar heist that ended with an explosion in San Pedro harbor – leaving few survivors. Verbal lures his interrogators with an incredible story of the crime lord's almost supernatural prowess.",82
52,"When Lenny and his wife, Amanda, adopt a baby, Lenny realizes that his son is a genius and becomes obsessed with finding the boy's biological mother in hopes that she will be brilliant too. But when he learns that Max's mother is Linda Ash, a kindhearted prostitute and porn star, Lenny is determined to reform her immoral lifestyle. A Greek chorus chimes in to relate the plot to Greek mythology in this quirky comedy.",68
53,"Fiore, an Italian conman, arrives in post Communist Albania with Gino, his young apprentice, to set up a shoe factory that will never open. The con requires a native Albanian, so they designate Spiro, an impoverished and confused former political prisoner as chairman of the board. When Fiore returns to Italy to get government funds for the project, Spiro unexpectedly disappears and Gino sets out on a journey to find him. The search leads him to discover Spiro's tragic personal history and witness Albanian poverty firsthand.",73
54,"In a depressed Texas town, British foreign exchange teacher Anna attempts to inject some life into her hopeless kids by introducing them to soccer. They're terrible at first, but Anna and her football-hero assistant whip them into shape. As they work overtime, the pair help kids build their self-esteem and also get involved in solving family squabbles.",55
55,"Sadie looks up to her older sister Georgia, a successful folk singer who's happily married with children, but can't break out of the bar-band circuit and hit the big time she desperately covets. It's in part due to her attraction to drugs and booze, and also to her own unwise choice in men. Finally, though, Sadie's Achilles heel is a rough, unlovely voice very different than her sister's crowd-pleasing singing.",58
58,Simple Italian postman learns to love poetry while delivering mail to a famous poet; he uses this to woo local beauty Beatrice.,80
60,A nine-year-old boy gets a plastic Indian and a cupboard for his birthday and finds himself involved in adventure when the Indian comes to life and befriends him.,64
61,"It's fire and brimstone time as grieving mother Karen McCann takes justice into her own hands when a kangaroo court in Los Angeles fails to convict Robert Doob, the monster who raped and murdered her 17-year-old daughter.",61
62,"In 1965, passionate musician Glenn Holland takes a day job as a high school music teacher, convinced it's just a small obstacle on the road to his true calling: writing a historic opus. As the decades roll by with the composition unwritten but generations of students inspired through his teaching, Holland must redefine his life's purpose.",70
63,"When Ashtray moves to South Central L.A. to live with his father (who appears to be the same age he is) and grandmother (who likes to talk tough and smoke reefer), he falls in with his gang-banging cousin Loc Dog, who along with the requisite pistols and Uzi carries a thermo-nuclear warhead for self-defense. Will Ashtray be able to keep living the straight life?",70
65,"Bud and Doyle are two losers who are doing nothing with their lives. Both of their girlfriends are actively involved in saving the environment, but the two friends couldn't care less about saving the Earth. One day, when a group of scientists begin a mission to live inside a ""Bio-Dome"" for a year without outside contact, Bud and Doyle mistakenly become part of the project themselves.",45
66,"Jobe is resuscitated by Jonathan Walker. He wants Jobe to create a special computer chip that would connect all the computers in the world into one network, which Walker would control and use. But what Walker doesn't realize is a group of teenage hackers are on to him and out to stop his plan.",29
68,"After learning of her husband's infidelities, a housewife invites an itinerant lesbian to move in with them. None of their lives will ever be the same again.",60
69,"Craig and Smokey are two guys in Los Angeles hanging out on their porch on a Friday afternoon, smoking and drinking, looking for something to do.",71
70,"Seth Gecko and his younger brother Richard are on the run after a bloody bank robbery in Texas. They escape across the border into Mexico and will be home-free the next morning, when they pay off the local kingpin. They just have to survive 'from dusk till dawn' at the rendezvous point, which turns out to be a Hell of a strip joint.",70
71,"Max Kirkpatrick is a cop who protects Kate McQuean, a civil law attorney, from a renegade KGB team out to terminate her",50
72,"After college graduation, Grover's girlfriend Jane tells him she's moving to Prague to study writing. Grover declines to accompany her, deciding instead to move in with several friends, all of whom can't quite work up the inertia to escape their university's pull. Nobody wants to make any big decisions that would radically alter his life, yet none of them wants to end up like Chet, the professional student who tends bar and is in his tenth year of university studies.",63
73,"In France during World War II, a poor and illiterate man, Henri Fortin (Jean-Paul Belmondo), is introduced to Victor Hugo's classic novel Les Misérables and begins to see parallels between the book and his own life.",69
73,"In France during World War II, a poor and illiterate man, Henri Fortin (Jean-Paul Belmondo), is introduced to Victor Hugo's classic novel Les Misérables and begins to see parallels between the book and his own life.",69
73,"In France during World War II, a poor and illiterate man, Henri Fortin (Jean-Paul Belmondo), is introduced to Victor Hugo's classic novel Les Misérables and begins to see parallels between the book and his own life.",69
73,"In France during World War II, a poor and illiterate man, Henri Fortin (Jean-Paul Belmondo), is introduced to Victor Hugo's classic novel Les Misérables and begins to see parallels between the book and his own life.",69
74,"The seeds of love are planted when Lisa, a high-powered investment banker, receives flowers from a secret admirer. But when his fairy-tale fantasies clash with her workaholic ways, they soon find out that sometimes, it's harder than it seems for love to conquer all.",59
75,"A writer returns to his hometown where he faces the childhood nemesis whose life he ultimately ruined, only the bully wants to relive their painful past by torturing him once again.",45
76,"SIRIUS 6B, Year 2078. On a distant mining planet ravaged by a decade of war, scientists have created the perfect weapon: a blade-wielding, self-replicating race of killing devices known as Screamers designed for one purpose only -- to hunt down and destroy all enemy life forms.",62
77,"A look into the many lives of Christa Päffgen, otherwise known as Nico; from cutie German mädchen to the first of the supermodels, to glamorous diva of the Velvet Underground, to cult item, junkie and hag. Many faces for the same woman, whom, you realize, just couldn't bring herself to care enough to live.",69
78,"After his daughter died in a hit and run, Freddy Gale has waited six years for John Booth, the man responsible, to be released from prison. On the day of release, Gale visits Booth and announces that he will kill him in one week. Booth uses his time to try and make peace with himself and his entourage, and even finds romance. Gale, whose life is spiraling down because of his obsession towards Booth, will bring himself on the very edge of sanity. At he end of the week, both men will find themselves on a collision course with each other.",61
79,"With his gangster boss on trial for murder, a mob thug known as ""the Teacher"" tells Annie Laird she must talk her fellow jurors into a not-guilty verdict, implying that he'll kill her son Oliver if she fails. She manages to do this, but, when it becomes clear that the mobsters might want to silence her for good, she sends Oliver abroad and tries to gather evidence of the plot against her, setting up a final showdown.",55
80,Several people try to take advantage of a little girl's innocence to hustle money her mom gave to her to buy a goldfish with.,76
81,Five different criminals face imminent death after botching a job quite badly.,65
82,"After World War II, Antonia and her daughter, Danielle, go back to their Dutch hometown, where Antonia's late mother has bestowed a small farm upon her. There, Antonia settles down and joins a tightly-knit but unusual community. Those around her include quirky friend Crooked Finger, would-be suitor Bas and, eventually for Antonia, a granddaughter and great-granddaughter who help create a strong family of empowered women.",70
83,"This film relates the story of a tightly connected Afro-American community informally called Colored Town where the inhabitants live and depend on each other in a world where racist oppression is everywhere, as told by a boy called Cliff who spent his childhood there. Despite this, we see the life of the community in all its joys and sorrows, of those that live there while others decide to leave for a better life north. For those remaining, things come to a serious situation when one prominent businessman is being muscled out by a white competitor using racist intimidation. In response, the community must make the decision of whether to submit meekly like they always have, or finally fight for their rights.",53
85,"In Victorian England, wealthy patriarch Sir Harald Alabaster invites an impoverished biologist, William Adamson, into his home. There, William tries to continue his work, but is distracted by Alabaster's seductive daughter, Eugenia. William and Eugenia begin a torrid romance, but as the couple become closer, the young scientist begins to realize that dark, disturbing things are happening behind the closed doors of the Alabaster manor.",65
86,"In 1960, a hardy group of prep school students boards an old-fashioned sailing ship. With Capt. Christopher Sheldon at the helm, the oceangoing voyage is intended to teach the boys fortitude and discipline. But the youthful crew are about to get some unexpected instruction in survival when they get caught in the clutches of a white squall storm.",63
87,"Hotel manager Robert Grant is forced by his boss to postpone his family vacation when a hotel critic checks in. Trouble is, the critic is really a villainous jewel thief with an orangutan assistant named Dunston. When Dunston gets loose and tries to escape a life of crime -- aided by Robert's sons -- havoc, hijinks and lots of laughs abound!",54
88,"When dignified Albert Donnelly runs for Governor, his team moves to keep his slow-witted and klutzy younger brother, Mike, out of the eye of the media. To baby-sit Mike, the campaign assigns sarcastic Steve, who gets the experience of a lifetime when he tries to take Mike out of town during the election.",60
88,"When dignified Albert Donnelly runs for Governor, his team moves to keep his slow-witted and klutzy younger brother, Mike, out of the eye of the media. To baby-sit Mike, the campaign assigns sarcastic Steve, who gets the experience of a lifetime when he tries to take Mike out of town during the election.",60
89,"An unimpressive, every-day man is forced into a situation where he is told to kill a politician to save his kidnapped daughter.",62
92,"A housemaid falls in love with Dr. Jekyll and his darkly mysterious counterpart, Mr. Hyde.",59
93,"Maximillian, the lone survivor of a race of vampires, comes to Brooklyn in search of a way to live past the next full moon. His ticket to survival is Rita, a NYPD detective who doesn't know she's half vampire -- and Maximillian will do whatever's necessary to put her under his spell.",50
