moveId,sinopsis,rating
4531,A tough Russian policeman is forced to partner up with a cocky Chicago police detective when he is sent to Chicago to apprehend a Georgian drug lord who killed his partner and fled the country.,62
4533,"When foreman Frank shows new employee Freddy a secret military experiment in a supply warehouse in Louisville, Kentucky, the two klutzes accidentally release a gas that reanimates corpses into flesh-eating zombies. As the epidemic spreads throughout the town, and the creatures satisfy their hunger in gory and outlandish ways, Frank and Freddy fight to survive with the help of their boss and a mysterious mortician.",71
4534,"After a few years trying to earn money to marry Jessica Harrison, Jim Craig returns to Snowy River. But he finds that a lot of things have changed.",68
4535,Jim Craig has lived his first 18 years in the mountains of Australia on his father's farm. The death of his father forces him to go to the lowlands to earn enough money to get the farm back on its feet.,69
4537,"The Popes are a family who haven't been able to use their real identity for years. In the late sixties, the parents set a weapons lab afire in an effort to hinder the government's Vietnam war campaign. Ever since then, the Popes have been on the run with the authorities never far behind.",76
4541,"A Harvard anthropologist is sent to Haiti to retrieve a strange powder that is said to have the power to bring human beings back from the dead. In his quest to find the miracle drug, the cynical scientist enters the rarely seen netherworld of walking zombies, blood rites and ancient curses. Based on the true life experiences of Wade Davis and filmed on location in Haiti, it's a frightening excursion into black magic and the supernatural.",64
4553,"Nada, a wanderer without meaning in his life, discovers a pair of sunglasses capable of showing the world the way it truly is. As he walks the streets of Los Angeles, Nada notices that both the media and the government are comprised of subliminal messages meant to keep the population subdued, and that most of the social elite are skull-faced aliens bent on world domination. With this shocking discovery, Nada fights to free humanity from the mind-controlling aliens.",73
4544,"Robot Johnny 5 moves to the city to help his friend Ben Jahrvi with his toy manufacturing enterprise, only to be manipulated by criminals who want to use him for their own nefarious purposes.",61
4545,"After a lightning bolt zaps a robot named Number 5, the lovable machine starts to think he's human and escapes the lab. Hot on his trail is his designer, Newton, who hopes to get to Number 5 before the military does. In the meantime, a spunky animal lover mistakes the robot for an alien and takes him in, teaching her new guest about life on Earth.",66
4552,"A ""metal fetishist"", driven mad by the maggots wriggling in the wound he's made to embed metal into his flesh, runs out into the night and is accidentally run down by a Japanese businessman and his girlfriend. The pair dispose of the corpse in hopes of quietly moving on with their lives. However, the businessman soon finds that he is now plagued by a vicious curse that transforms his flesh into iron.",70
4546,A man embarks on an increasingly obsessive search for his girlfriend after she disappears without a trace during a romantic summer getaway to France.,75
4565,"Joe Armstrong, an orphaned drifter with little respect for much other than martial arts, finds himself on an American Army base in The Philippines after a judge gives him a choice of enlistment or prison. On one of his first missions driving a convoy, his platoon is attacked by a group of rebels who try to steal the weapons the platoon is transporting and kidnap the base colonel's daughter.",59
4557,"Ypsilanti, Michigan, 1945. Engineer Preston Tucker dreams of designing the car of future, but his innovative envision will be repeatedly sabotaged by his own unrealistic expectations and the Detroit automobile industry tycoons.",67
4562,"Sherlock Holmes is as dashing as ever, but with a little secret: Dr. Watson is the brains behind the operation. When Reginald Kincaid, the actor he has hired to play Holmes becomes insufferable, Watson fires him and tries to go out on his own, but finds that he has done too good a job building Holmes up in the public's mind.",66
4572,"Two New York cops get involved in a gang war between members of the Yakuza, the Japanese Mafia. They arrest one of their killers and are ordered to escort him back to Japan. However, in Japan he manages to escape, and as they try to track him down, they get deeper and deeper into the Japanese Mafia scene and they have to learn that they can only win by playing the game—the Japanese way.",66
4571,"Bill and Ted are high school buddies starting a band. They are also about to fail their history class—which means Ted would be sent to military school—but receive help from Rufus, a traveller from a future where their band is the foundation for a perfect society. With the use of Rufus' time machine, Bill and Ted travel to various points in history, returning with important figures to help them complete their final history presentation.",69
4573,"This movie tells the story of the latter years of Earl Long, a flamboyant governor of Louisiana. The aging Earl, an unapologetic habitue of strip joints, falls in love with young stripper Blaze Starr. When Earl and Blaze move in together, Earl's opponents use this to attack his controversial political program, which included civil rights for blacks in the 1950's.",64
4564,"Aerial firefighter Pete risks himself and his vintage World War II airplane in a constant and death-defying quest to fight forest wildfires, much to the dismay of his girlfriend, Dorinda . His love for Dorinda and the advice of fellow pilot Al convince Pete to give up his perilous career, but he flies one last mission. Pete heroically saves Al's plane from certain destruction, but with supernatural consequences.",63
4563,"Albert Einstein is the son of a Tasmanian apple farmer, who discovers the secret of splitting the beer atom to put the bubbles back into beer. When Albert travels to Sydney to patent his invention he meets beatuiful French scientist Marie Curie, as well as several unscrupulous types who try to take advantage of the naive genius and his invention.",50
4574,"A blind Vietnam vet, trained as a swordfighter, comes to America and helps to rescue the son of a fellow soldier.",66
4577,"During the Vietnam War, a soldier finds himself the outsider of his own squad when they unnecessarily kidnap a female villager.",71
4580,A martial artist hunts a killer in a plague-infested urban dump of the future.,56
4578,"Louie Jeffries is happily married to Corinne. On their first anniversary, Louie is killed crossing the road. Louie is reincarnated as Alex Finch, and twenty years later, fate brings Alex and Louie's daughter, Miranda, together. It's not until Alex is invited to Louie's home that he begins to remember his former life, wife and best friend. Of course, there's also the problem that he's attracted to Louie's/his own daughter.",67
4581,"A busy executive learns during a meeting that his mother may be dying and rushes home to her side. He ends up being his father's caretaker and becomes closer to him than ever before. Estranged from his own son, the executive comes to realize what has been missing in his own life.",62
4583,"Lou Diamond Phillips and Fred Gwynne team up with a gang of professional criminals who have everything it takes to rob a bank. The only things they do have going for them are a cop and his partner, who are dumber than they are! By the time the gang hits the bank vault, it's a safe bet there's going to be organized insanity and disorganized crime!",54
4584,"Bobby Kellar has a crush on Lainie Diamond, girlfriend of school jerk Joel. Coleman is working on an experiment which will help him move into a place where Dreams are reality. When an accident occurs Coleman finds himself in Bobby's body and can only contact Bobby in his dreams.",59
4585,This morning they were playing ping-pong in the hospital rec room. Now they're lost in New York and framed for murder. This was never covered in group therapy.,61
4587,"In this musical comedy, Valerie is dealing with her philandering fiancé, Ted, when she finds that a trio of aliens have crashed their spaceship into her swimming pool. Once the furry beings are shaved at her girlfriend's salon, the women discover three handsome men underneath. After absorbing the native culture via television, the spacemen are ready to hit the dating scene in 1980s Los Angeles.",57
4589,"A television newswoman picks up the story of a 1960s rock band whose long-lost leader — Eddie Wilson — may still be alive, while searching for the missing tapes of the band's never-released album.",67
4591,"Erik the Viking gathers warriors from his village and sets out on a dangerous journey to Valhalla, to ask the gods to end the Age of Ragnorok and allow his people to see sunlight again. A Pythonesque satire of Viking life.",58
4593,"Jessie is an aging career criminal who has been in more jails, fights, schemes, and lineups than just about anyone else. His son Vito, while currently on the straight and narrow, has had a fairly shady past and is indeed no stranger to illegal activity. They both have great hope for Adam, Vito's son and Jessie's grandson, who is bright, good-looking, and without a criminal past.",56
4599,"The story of Jerry Lee Lewis, arguably the greatest and certainly one of the wildest musicians of the 1950s. His arrogance, remarkable talent, and unconventional lifestyle often brought him into conflict with others in the industry, and even earned him the scorn and condemnation of the public.",63
4600,"Joe Slovak is a brilliant first-year med student whose casual, nonconforming approach to life gets tested when he enrolls in Gross Anatomy, the toughest course in med school.",55
4595,"Assigned to oversee the development of the atomic bomb, Gen. Leslie Groves is a stern military man determined to have the project go according to plan. He selects J. Robert Oppenheimer as the key scientist on the top-secret operation, but the two men clash fiercely on a number of issues. Despite their frequent conflicts, Groves and Oppenheimer ultimately push ahead with two bomb designs — the bigger ""Fat Man"" and the more streamlined ""Little Boy.""",63
4594,An American soldier who escapes the execution of his comrades by Japanese soldiers in Borneo during WWII becomes the leader of a personal empire among the headhunters in this war story told in the style of Joseph Conrad and Rudyard Kipling. The American is reluctant to rejoin the fight against the Japanese on the urging of a British commando team but conducts a war of vengeance when the Japanese attack his adopted people.,60
4602,"'Sugar' Ray is the owner of an illegal casino and must contend with the pressure of vicious gangsters and corrupt police who want to see him go out of business. In the world of organised crime and police corruption in the 1920s, any dastardly trick is fair.",61
4605,Pressure from his boss and a skin-cream client produces a talking boil on a British adman's neck.,63
4603,"A writer of BAD detective novels is in full writers' block. He pretends to be the alibi of a beautiful woman who was arrested for murder at first thinking her innocent, but as she shows more and more interesting abilities (such as knife throwing) he begins to doubt his first assessment.",54
4608,"Jimmie Rainwood was minding his own business when two corrupt police officers (getting an address wrong) burst into his house, expecting to find a major drug dealer. Rainwood is shot, and the officers frame him as a drug dealer. Rainwood is convicted of drug dealing, based on the perjured evidence of a police informant. Thrown into a seedy jail, fighting to prove his innocence is diffucult when he has to deal with the realities of prison life, where everyone claims they were framed.",61
4610,"Nick and Frank Starkey were both policemen. A scandal forced Nick to leave the force, now a serial killer has driven the police to take him back. A web that includes Frank's wife, bribery, and corruption all are in the background as Nick tries to uncover the secret of where the killer will strike next, and finally must lay a trap without the police.",50
4611,"A career criminal who has been deformed since birth is given a new face by a kindly doctor and paroled from prison. It appears that he has gone straight, but he is really planning his revenge on the man who killed his mentor and sent him to prison.",63
4612,A group of actors putting on an interpretive Passion Play in Montreal begin to experience a meshing of their characters and their private lives as the production takes form against the growing opposition of the Catholic church.,68
4597,"An Orange County teenager's carefree life of ditching class and skateboarding abandoned pools comes to a screeching halt when someone close to him dies. The cops rule the death a suicide, but the bereaved skater believes he was murdered. It's up to him to solve the case, with a skateboard.",59
4614,"If your enemy refuses to be humbled... Destroy him. Accompanied by his brother Kurt (Van Damme), American kickboxing champion Eric Sloane (Dennis Alexio), arrives in Thailand to defeat the Eastern warriors at their own sport. His opponent: ruthless fighter and Thai champion, Tong Po. Tong not only defeats Eric, he paralyzes him for life. Crazed with anger, Kurt vows revenge.",68
4616,"When principal Joe Clark takes over decaying Eastside High School, he's faced with students wearing gang colors and graffiti-covered walls. Determined to do anything he must to turn the school around, he expels suspected drug dealers, padlocks doors and demands effort and results from students, staff and parents. Autocratic to a fault, this real-life educator put it all on the line.",73
4615,A gallery of characters in Brooklyn in the 1950s are crushed by their surroundings and selves: a union strike leader discovers he is gay; a prostitute falls in love with one of her clients; a family cannot cope with the fact that their daughter is illegitimately pregnant.,66
4617,"An average kind of guy who has a slight problem with gambling goes to the track, and mystically, it seems as though he can't lose, no matter how he bets; and he has an incredible day.",64
4619,A young boy is scared of the monster under his bed. He asks his 6th grade brother to swap rooms for the night as a bet that the monster really exists. Soon the brother becomes friends with the monster and discovers a whole new world of fun and games under his bed where pulling pranks on kids and other monsters is the main attraction.,58
4621,"Mollie is a single working mother who's out to find the perfect father for her child. Her baby, Mikey, prefers James, a cab driver turned babysitter who has what it takes to make them both happy. But Mollie won't even consider James. It's going to take all the tricks a baby can think of to bring them together before it's too late.",63
4622,"Randy Bodek works as a pizza delivery boy at Senor Pizza to make a few extra bucks. Some customers are special, though: When the order is for a pizza with extra anchovies, it means the female customers are looking for some loving. ""Loverboy's"" reputation soon makes him very popular, but when Mom Bodek suddenly feels like some extra anchovies, things are looking grim for young Randy",62
4623,"When Rachel Phelps inherits the Cleveland Indians from her deceased husband, she's determined to move the team to a warmer climate—but only a losing season will make that possible, which should be easy given the misfits she's hired. Rachel is sure her dream will come true, but she underestimates their will to succeed.",69
4626,"After 30 years of searching, Harry has finally met the girl of his dreams. Unfortunately, before they even have a chance to go on their first date, Harry intercepts some chilling news: WWIII has begun and nuclear missiles will destroy Los Angeles in less than an hour!",70
4628,"Three stories happening in New York. The first, by Scorsese, is about a painter who creates his works helped by high volume music and an attractive assistant; second, by Coppola, is about a rich and bold 12 years old who helps her separated parents to reconciliate; third, by Allen, is a witty piece of comedy about the impossibility of getting rid of the son's role.",63
4630,"Rip is the World Wrestling Federation champion who is faithful to his fans and the network he wrestles for, but Brell, the new head of the World Television Network, wants Rip to wrestle for his network.",49
4632,"Experienced Green Beret sergeant Johnny Gallagher is escorting a prisoner, Airborne Ranger Thomas Boyette, back to the US, but Boyette escapes and Gallagher must risk life and limb to catch him.",60
4634,"Penn & Teller enjoy playing jokes on each other. When Penn says on an interview show that he wishes he has someone threatening his life so that he ""wouldn't sweat the small stuff,"" each of them begins a series of pranks on the other to suggest a real threat. Then they find that a real psychopath is interested in them.",56
4636,"The avenging angel of Marvel Comics fame comes brilliantly to life in this searing action-adventure thriller! Dolph Lundgren stars as Frank Castle, a veteran cop who loses his entire family to a mafia car bomb. His ex-partner believes Castle survived the blast and became the Punisher, living in the sewers and exacting vigilante violence against mob bosses throughout the city. When the populace is caught in the midst of a gang war that he caused, Castle must again emerge from the shadows and save the innocent.",57
4635,A bounty hunter helps out the wife of a bail-jumper after her child is kidnapped by neo-Nazi types.,55
4638,"In need of funds for research, Dr. Alan Grant accepts a large sum of money to accompany Paul and Amanda Kirby on an aerial tour of the infamous Isla Sorna. It isn't long before all hell breaks loose and the stranded wayfarers must fight for survival as a host of new -- and even more deadly -- dinosaurs try to make snacks of them.",61
4640,"A Japanese Yakuza gangster’s deadly existence in his homeland gets him exiled to Los Angeles, where he is taken in by his little brother and his brother’s gang.",71
4639,"In the midst of a nasty public breakup of married movie stars, a studio publicist scrambles to put a cap on the escalating situation as the couple's latest film has found it's only print kidnapped by the director.",57
4641,"Two quirky, cynical teenaged girls try to figure out what to do with their lives after high school graduation. After they play a prank on an eccentric, middle aged record collector, one of them befriends him, which causes a rift in the girls' friendship.",71
4645,"A wave of gruesome murders is sweeping Tokyo. The only connection is a bloody X carved into the neck of each of the victims. In each case, the murderer is found near the victim and remembers nothing of the crime. Detective Takabe and psychologist Sakuma are called in to figure out the connection, but their investigation goes nowhere...",74
4642,"Raised a boy in East Berlin, Hedwig undergoes a personal transformation in order to emigrate to the U.S., where she reinvents herself as an “internationally ignored” but divinely talented rock diva, inhabiting a “beautiful gender of one.”",75
2529,"Astronaut Taylor crash lands on a distant planet ruled by apes who use a primitive race of humans for experimentation and sport. Soon Taylor finds himself among the hunted, his life in the hands of a benevolent chimpanzee scientist.",76
4644,An endearing light comedy about a woman who spontaneously becomes a resident of Venice after her family left her begin. While enjoying the wonderful people she meets she achieves a new life and the first time independent of her family.,73
4646,"Clive Owen stars as a prison inmate who goes into an experimental ""open"" prison where the inmates walk around freely and get job training for their impending releases. While there, he discovers he has a talent for growing flowers. His talent is recognized by a gardening guru who encourages him and four other inmates to enter a national gardening competition",64
4653,"It's 1649: Mazarin hires the impoverished D'Artagnan to find the other musketeers: Cromwell has overthrown the English king, so Mazarin fears revolt, particularly from the popular Beaufort. Porthos, bored with riches and wanting a title, signs on, but Aramis, an abbé, and Athos, a brawler raising an intellectual son, assist Beaufort in secret. When they fail to halt Beaufort's escape from prison, the musketeers are expendable, and Mazarin sends them to London to rescue Charles I. They are also pursued by Justine, the avenging daughter of Milady de Winter, their enemy 20 years ago. They must escape England, avoid Justine, serve the Queen, and secure Beauford's political reforms.",64
4658,"A young man is confined in a mental hospital. Through a flashback we see that he was traumatized as a child, when he and his family were circus performers. Back in the present, he escapes and rejoins his surviving and armless mother.",71
4654,"The Double Deuce is the meanest, loudest and rowdiest bar south of the Mason-Dixon Line, and Dalton has been hired to clean it up. He might not look like much, but the Ph.D.-educated bouncer proves he's more than capable -- busting the heads of troublemakers and turning the roadhouse into a jumping hot-spot. But Dalton's romance with the gorgeous Dr. Clay puts him on the bad side of cutthroat local big shot Brad Wesley.",66
4660,The widow's houseboy and the divorcee's chauffeur bet on which will bed the other's employer first.,57
4661,"Seen-it-all New York detective Frank Keller is unsettled - he has done twenty years on the force and could retire, and he hasn't come to terms with his wife leaving him for a colleague. Joining up with an officer from another part of town to investigate a series of murders linked by the lonely hearts columns he finds he is getting seriously and possibly dangerously involved with Helen, one of the main suspects.",66
4662,"A murder takes place in the shop of David Lyons, a deaf man who fails to hear the gunshot being fired. Outside, blind man Wally Karue hears the shot but cannot see the perpetrator. Both are arrested, but escape to form an unlikely partnership. Being chased by both the law AND the original killers, can the pair work together to outwit them all?",67
4663,A Los Angeles radio-station manager's girlfriend shows his teenage daughter how to be sexy.,51
4666,"Hard-drinking novelist Zach Hutton spirals out of control after his wife and mistress both leave him. Alone and crippled by a bad case of writer's block, Zach slips in and out of casual relationships and one-night stands, while his drinking becomes more and more severe. With the help of a bartender and his therapist, Zach confronts his demons -- women and alcohol -- and rediscovers his writing voice.",62
4671,An introspective young woman's life is upturned by the arrival of her maladjusted sister.,60
4670,"A seemingly mild mannered man -- who has just murdered his entire family -- quickly adopts a new identity and leaves town. After building a new relationship with a widow and her teenage daughter, he struggles to hide his true identity and maintain a grip on reality.",65
4672,An American actor in England tries to find love and work.,57
4675,"On his first day after being released from jail for 14 armed bank robberies, Lucas finds himself caught up in someone else's robbery. Perry has decided to hold up the local bank to raise money so that he can keep his daughter, Meg, and get her the treatment she needs. Dugan, a detective, assumes Lucas helped plan the robbery, and hence Lucas, Perry and Meg become three fugitives.",67
4676,A Beverly Hills housewife in the middle of a divorce tries to find focus in her life by taking over her daughter's Wilderness Girls troop.,57
4679,"Buck Russell, a lovable but slovenly bachelor, suddenly becomes the temporary caretaker of his nephew and nieces after a family emergency. His freewheeling attitude soon causes tension with his older niece Tia, loyal girlfriend Chanice and just about everyone else who crosses his path.",68
4677,"Scott Turner has 3 days left in the local police department before he moves to a bigger city to get some 'real' cases—not just misdemeanors. When Amos Reed is murdered, Scott sets himself on the case, but the closest thing to a witness to the murder is Reed's dog, Hooch, which Scott has to take care of—to avoid Hooch being 'put to sleep'.",64
4678,The eccentric new manager of a UHF television channel tries to save the station from financial ruin with an odd array of programming.,68
4681,"The Roses, Barbara and Oliver, live happily as a married couple. Then she starts to wonder what life would be like without Oliver, and likes what she sees. Both want to stay in the house, and so they begin a campaign to force each other to leave. In the middle of the fighting is D'Amato, the divorce lawyer. He gets to see how far both will go to get rid of the other, and boy do they go far.",69
4673,"Ray Tango and Gabriel Cash are narcotics detectives who, while both being extremely successful, can't stand each other. Crime Lord Yves Perret, furious at the loss of income that Tango and Cash have caused him, frames the two for murder. Caught with the murder weapon on the scene of the crime, the two have no alibi. Thrown into prison with most of the criminals they helped convict, it appears that they are going to have to trust each other if they are to clear their names and catch the evil Perret.",64
