movieId,sinopsis,rating
497,"In this Shakespearean farce, Hero and her groom-to-be, Claudio, team up with Claudio's commanding officer, Don Pedro, the week before their wedding to hatch a matchmaking scheme. Their targets are sharp-witted duo Benedick and Beatrice -- a tough task indeed, considering their corresponding distaste for love and each other. Meanwhile, meddling Don John plots to ruin the wedding.",70
497,"In this Shakespearean farce, Hero and her groom-to-be, Claudio, team up with Claudio's commanding officer, Don Pedro, the week before their wedding to hatch a matchmaking scheme. Their targets are sharp-witted duo Benedick and Beatrice -- a tough task indeed, considering their corresponding distaste for love and each other. Meanwhile, meddling Don John plots to ruin the wedding.",70
499,"Electrician Gus gets the chance to fulfil a childhood dream by buying an old bowling-alley with some of his friends, but first he must find his ex-wife a new husband so he can stop paying alimony.",57
500,"Loving but irresponsible dad Daniel Hillard, estranged from his exasperated spouse, is crushed by a court order allowing only weekly visits with his kids. When Daniel learns his ex needs a housekeeper, he gets the job -- disguised as an English nanny. Soon he becomes not only his children's best pal but the kind of parent he should have been from the start.",72
501,An unemployed Brit vents his rage on unsuspecting strangers as he embarks on a nocturnal London odyssey.,74
502,"Mr. Miyagi decides to take Julie, a troubled teenager, under his wing after he learns that she blames herself for her parents' demise and struggles to adjust with her grandmother and fellow pupils.",53
504,"In the year 2022, a ruthless prison warden has created the ultimate solution for his most troublesome and violent inmates: Absolom, a secret jungle island where prisoners are abandoned and left to die. But Marine Captain John Robbins, convicted of murdering a commanding officer, is determined to escape the island in order to reveal the truth behind his murderous actions and clear his name.",63
505,"Eleven-year-old North has had it with his parents. They are always busy with their careers and don't give North the attention he needs, so he files a lawsuit against them. The judge rules that North should either find new parents or return to his own parents within two months. Thus North starts off on a journey around the world to find parents that really care about him.",51
506,"England, 1600. Queen Elizabeth I promises Orlando, a young nobleman obsessed with poetry, that she will grant him land and fortune if he agrees to satisfy a very particular request.",70
507,"A kidnapped boy strikes up a friendship with his captor: an escaped convict on the run from the law, headed by an honorable U.S. Marshal.",75
508,Two competing lawyers join forces to sue a prestigious law firm for AIDS discrimination. As their unlikely friendship develops their courage overcomes the prejudice and corruption of their powerful adversaries.,77
509,"After a long voyage from Scotland, pianist Ada McGrath and her young daughter, Flora, are left with all their belongings, including a piano, on a New Zealand beach. Ada, who has been mute since childhood, has been sold into marriage to a local man named Alisdair Stewart. Making little attempt to warm up to Alisdair, Ada soon becomes intrigued by his Maori-friendly acquaintance, George Baines, leading to tense, life-altering conflicts.",74
511,"Several players from different backgrounds try to cope with the pressures of playing football at a major university. Each deals with the pressure differently, some turn to drinking, others to drugs, and some to studying.",63
512,The Earth is invaded by alien parasites—AKA 'slugs'—that ride on people's backs and control their minds.,58
513,"In 1939, WBN, a fourth radio network, is about to take to America's airwaves. As if the confusion of the premiere night wasn't enough, Penny Henderson, the owner's secretary, must deal with an unhappy sponsor, an overbearing boss and a soon-to-be ex-husband who desperately wants her back. As the broadcast begins, a mysterious voice breaks the broadcast and suddenly members of the cast turn up dead. It's up to her husband Roger, to find out whodunit as the police chase him through the halls of WBN.",59
514,"Caroline and Lloyd are a married couple constantly at each other's throats, masters at crafting acid-tongued barbs at the other's expense. Indeed, they are so obsessed with belittling each other that they never stop -- not even at gunpoint. The gunman is Gus, a thief on the run from the police, who kidnaps the couple as an insurance policy, planning to use their home as a hideout. But their incessant bickering proves more than Gus bargained for, forcing him -- for the sake of his own sanity -- into the unenviable role of peacemaker. To make things even worse for Gus, he discovers that he has taken the couple hostage the night of their big Christmas party, and the guests are already on the way. Not wanting to leave Lloyd and Caroline unattended, Gus opts to attend the party, pretending to be the couple's marriage counselor. This naturally leads to a series of comic confusions, as the hostage crisis and marital tensions head towards their inevitable conclusion.",65
515,A rule bound head butler's world of manners and decorum in the household he maintains is tested by the arrival of a housekeeper who falls in love with him in post-WWI Britain. The possibility of romance and his master's cultivation of ties with the Nazi cause challenge his carefully maintained veneer of servitude.,74
516,"An advertising man is slowly sliding downhill. When he is fired from his job in Detroit, he signs up for unemployment. One day they find him a job: teaching thinking skills to Army recruits. He arrives on base to find that there is no structure set up for the class.",61
517,"When a prostitute is found dead in a Los Angeles skyscraper occupied by a large Japanese corporation, detectives John Connor and Web Smith are called in to investigate. Although Connor has previous experience working in Japan, cultural differences make their progress difficult until a security disc showing the murder turns up. Close scrutiny proves the disc has been doctored, and the detectives realize they're dealing with a cover-up as well.",61
518,"An unhappy young couple visit the infamous Kellogg spa in Battle Creek, Michigan while a young hustler tries get into the breakfast-cereal business and compete against John Kellogg's corn flakes.",56
519,"The mega corporation Omni Consumer Products is still bent on creating their pet project, Delta City, to replace the rotting city of Detroit. Unfortunately, the inhabitants of the area have no intention of abandoning their homes simply for desires of the company. To this end, OCP have decided to force them to leave by employing a ruthless mercenary army to attack and harass them. An underground resistance begins and in this fight, Robocop must decide where his loyalties lie.",47
520,"Robin Hood comes home after fighting in the Crusades to learn that the noble King Richard is in exile and that the despotic King John now rules England, with the help of the Sheriff of Rottingham. Robin Hood assembles a band of fellow patriots to do battle with King John and the Sheriff.",66
521,A corrupt cop gets in over his head when he tries to assassinate a beautiful Russian hit-woman.,62
522,"Nazi skinheads in Melbourne take out their anger on local Vietnamese, who are seen as threatening racial purity. Finally the Vietnamese have had enough and confront the skinheads in an all-out confrontation, sending the skinheads running. A woman who is prone to epileptic seizures joins the skins' merry band, and helps them on their run from justice, but is her affliction also a sign of impurity?",66
523,"Reeling from her mother's recent death, Ruby Lee Gissing relocates to Florida to start anew. After finding a job at a souvenir store, Ruby becomes friends with the shop's owner, Mildred Chambers, and slowly acclimates to her new surroundings. Before long, she's juggling the affections of Mildred's Lothario son, Ricky, and the good-natured Mike. As she wavers between Ricky and Mike, Ruby also tries to come to terms with her past.",59
524,"Rudy grew up in a steel mill town where most people ended up working, but wanted to play football at Notre Dame instead. There were only a couple of problems. His grades were a little low, his athletic skills were poor, and he was only half the size of the other players. But he had the drive and the spirit of 5 people and has set his sights upon joining the team.",73
526,"Jean is young, gay, and promiscuous. Only after he meets one or two women, including Laura does he come to realize his bisexuality. Jean has to overcome a personal crisis and a tough choice between Laura and his male lover Samy.",66
527,The true story of how businessman Oskar Schindler saved over a thousand Jewish lives from the Nazis while they worked as slaves in his factory during World War II.,86
528,"When his star recruit botches a Major League Baseball debut, humiliated talent scout, Al Percolo gets banished to rural Mexico, where he finds a potential gold mine in the arm of young phenom Steve Nebraska. Soon, the Bronx Bombers put a $55 million contract on the table—provided a psychiatrist can affirm Nebraska's mental stability.",53
529,A prepubescent chess prodigy refuses to harden himself in order to become a champion like the famous but unlikable Bobby Fischer.,71
532,"She's the perfect all-American parent: a great cook and homemaker, a devoted recycler, and a woman who'll literally kill to keep her family happy.",68
534,"C.S. Lewis, a world-renowned writer and professor, leads a passionless life until he meets spirited poet Joy Gresham.",69
535,"Many loosely connected characters cross paths in this film, based on the stories of Raymond Carver. Waitress Doreen Piggot accidentally runs into a boy with her car. Soon after walking away, the child lapses into a coma. While at the hospital, the boy's grandfather tells his son, Howard, about his past affairs. Meanwhile, a baker starts harassing the family when they fail to pick up the boy's birthday cake.",72
536,"When Michael McCann is thrown over by the woman he loves, he becomes something of a misanthrope and a miser, spending all of his spare money on collectible gold coins. Living in the same town is an affluent family with two sons: John and Tanny. Tanny's a wild boy, whom John cannot control, and one night he breaks into McCann's house, and steals the gold and disappears, which nearly confirms McCann's distrust of mankind. But then, a mysterious young woman dies in the snow outside McCann's house, and her small daughter makes her way to McCann's house and into McCann's life and heart.",60
538,"The story of a young, gay, black, con artist who, posing as the son of Sidney Poitier, cunningly maneuvers his way into the lives of a white, upper-class New York family.",64
539,"When Sam Baldwin's wife dies, he is left to bring up his eight-year-old son Jonah alone, and decides to move to Seattle to make a new start. On Christmas Eve, Jonah rings a radio phone-in with his Christmas wish to find a new wife for his dad. Meanwhile in Baltimore, journalist Annie Reed, who is having doubts about her own relationship, is listening in.",67
540,A woman moves into an apartment in Manhattan and learns that the previous tenant's life ended mysteriously after they fell from the balcony.,54
541,"In the smog-choked dystopian Los Angeles of 2019, blade runner Rick Deckard is called out of retirement to terminate a quartet of replicants who have escaped to Earth seeking their creator for a way to extend their short life spans.",79
542,"Country girl Rebecca has spent most of her life on a farm in South Dakota, and, when she goes away to college in Los Angeles, Rebecca immediately feels out of place in the daunting urban setting. She is befriended by a savvy party animal named Crawl, who convinces the ambivalent Rebecca to stay in the city. When Thanksgiving break rolls around, Rebecca, no longer an innocent farm girl, invites Crawl back to South Dakota, where he pretends to be her fiancé.",60
543,"Just after a bad breakup, Charlie MacKenzie falls for lovely butcher Harriet Michaels and introduces her to his parents. But, as voracious consumers of sensational tabloids, his parents soon come to suspect that Harriet is actually a notorious serial killer -- ""Mrs. X"" -- wanted in connection with a string of bizarre honeymoon killings. Thinking his parents foolish, Charlie proposes to Harriet. But while on his honeymoon with her, he begins to fear they were right.",61
544,"Coming from a police family, Tom Hardy ends up fighting his uncle after the murder of his father. Tom believes the killer is another cop, and goes on the record with his allegations. Demoted to water-way duty Tom, along with new partner Jo Christman, navigate the three rivers looking for clues and discovering bodies. This time the victims are women Tom knows, he must find the killer to prove his innocence.",58
546,"Mario and Luigi, plumbers from Brooklyn, find themselves in an alternate universe where evolved dinosaurs live in hi-tech squalor. They're the only hope to save our universe from invasion by the dino dictator, Koopa.",43
547,"A homeless man is hired as a survival guide for a group of wealthy businessmen on a hunting trip in the mountains, unaware that they are killers who hunt humans for sport, and that he is their new prey.",61
548,A maverick skydiver and a former KGB agent team up to stop the Russian mafia from stealing gold.,54
549,"A collection of vignettes highlighting different aspects of the life, work, and character of the acclaimed Canadian classical pianist.",72
550,"At a sizable public college, high-minded student Eddy is forced to room with the slovenly Stuart, but the pair strike up a surprising friendship. When attractive co-ed Alex is assigned to live with the two male students because of her gender-neutral name, a roundabout love triangle ensues. Eddy secretly yearns for Stuart, who wants Alex, but she prefers Eddy. The complex situation leads to sexual experimentation and strained relationships.",64
551,"Tired of scaring humans every October 31 with the same old bag of tricks, Jack Skellington, the spindly king of Halloween Town, kidnaps Santa Claus and plans to deliver shrunken heads and other ghoulish gifts to children on Christmas morning. But as Christmas approaches, Jack's rag-doll girlfriend, Sally, tries to foil his misguided plans.",78
552,"D'Artagnan travels to Paris hoping to become a musketeer, one of the French king's elite bodyguards, only to discover that the corps has been disbanded by conniving Cardinal Richelieu, who secretly hopes to usurp the throne. Fortunately, Athos, Porthos and Aramis have refused to lay down their weapons and continue to protect their king. D'Artagnan joins with the rogues to expose Richelieu's plot against the crown.",64
552,"D'Artagnan travels to Paris hoping to become a musketeer, one of the French king's elite bodyguards, only to discover that the corps has been disbanded by conniving Cardinal Richelieu, who secretly hopes to usurp the throne. Fortunately, Athos, Porthos and Aramis have refused to lay down their weapons and continue to protect their king. D'Artagnan joins with the rogues to expose Richelieu's plot against the crown.",64
552,"D'Artagnan travels to Paris hoping to become a musketeer, one of the French king's elite bodyguards, only to discover that the corps has been disbanded by conniving Cardinal Richelieu, who secretly hopes to usurp the throne. Fortunately, Athos, Porthos and Aramis have refused to lay down their weapons and continue to protect their king. D'Artagnan joins with the rogues to expose Richelieu's plot against the crown.",64
552,"D'Artagnan travels to Paris hoping to become a musketeer, one of the French king's elite bodyguards, only to discover that the corps has been disbanded by conniving Cardinal Richelieu, who secretly hopes to usurp the throne. Fortunately, Athos, Porthos and Aramis have refused to lay down their weapons and continue to protect their king. D'Artagnan joins with the rogues to expose Richelieu's plot against the crown.",64
553,"Legendary marshal Wyatt Earp, now a weary gunfighter, joins his brothers Morgan and Virgil to pursue their collective fortune in the thriving mining town of Tombstone. But Earp is forced to don a badge again and get help from his notorious pal Doc Holliday when a gang of renegade brigands and rustlers begins terrorizing the town.",76
555,"Clarence marries hooker Alabama, steals cocaine from her pimp, and tries to sell it in Hollywood, while the owners of the coke try to reclaim it.",75
556,"A behind-the-scenes documentary about the Clinton for President campaign, focusing on the adventures of spin doctors James Carville and George Stephanopoulos.",73
558,"Tyler knows a lot about accidents. So much so, he is scared to do anything that might endanger him, like riding his bike, or climbing into his treehouse. While in an old library, he is mystically transported into the unknown world of books, and he has to try and get home again.",64
562,An unattractive 7th grader struggles to cope with suburban life as the middle child with inattentive parents and bullies at school.,72
563,"It's mid 19th century, north of France. The story of a coal miner's town. They are exploited by the mine's owner. One day the decide to go on strike, and then the authorities repress them",67
564,"Military men Rock Reilly and Eddie Devane are tasked with taking a prisoner, blonde bombshell Toni Johnson, on what becomes an unforgettable road trip. Toni, an enlistee who's in trouble for deserting her unit, soon proves that she's craftier than most inmates.",53
567,"Kika, a happy-go-lucky, naïve cosmetologist, is called to the mansion of Nicholas Pierce, an American writer, to make-up the corpse of his stepson, Ramón, a fashion photographer with voyeuristic tendencies. He was however merely catatonic and suddenly awoke feeling he owns her his life regained. Ramón eventually proposes to Kika and they might have lived happily ever after but first they have to cope with Kika's torrid affair with Nicholas, the traumatic and suspicious suicide of Ramón's mother, and the intrusive gaze of a scarred exploitative tabloid-TV star (and Ramón's former psychologist), Andrea Caracortada.",66
568,A group of South Asian women try but cannot escape their problems on a day trip to a British beach resort.,53
569,"When the owner of the Minnesota Twins passes away, he bequeaths the team to his preteen grandson. The newly minted head honcho quickly appoints himself manager, causing unrest in an organisation that struggles to take orders from a 12-year-old.",58
573,"A bureaucratic snafu sends Marco Tullio Sperelli, a portly, middle-aged northern Italian, to teach third grade in a poor town outside Naples",72
574,"Bright young student Raymond Aibelli is forced to sidetrack an important medical internship because his mother, Susan, is recovering from a broken leg. When he isn't tasked with the most mundane aspects of Susan's recuperation, Raymond finds distraction in a neighborhood girl, Toni Peck. But, as Susan begins relying on her son for both physical and emotional needs, Raymond starts developing disturbing and unwanted new yearnings.",56
575,"When nine-year-old Alfalfa falls for Darla, his ""He-Man-Woman-Hating"" friends attempt to sabotage their relationship.",67
577,"The true story of how a marine seal named Andre befriended a little girl and her family, circa 1962.",54
579,"The film shows the difficulties of an honest, imperiled judge and his bodyguard of four men, trying to clean up a Sicilian town. Corrupt local politicians, working hand-in-hand with the Mafia, will stop at nothing to prevent exposure of their rackets.",64
580,"Bristol, England, early 19th century. A beautiful young stranger who speaks a weird language is tried for the crime of begging. But when a man claims that he can translate her dialect, it is understood that the woman is a princess from a far away land. She is then welcomed by a family of haughty aristocrats that only wants to heighten their prestige. However, the local reporter is not at all convinced she is what she claims to be and investigates. Is Caraboo really a princess?",56
581,"This documentary highlights the historical contexts that gay, lesbian, bisexual and transgender individuals have occupied in cinema history, and shows the evolution of the entertainment industry's role in shaping perceptions of LGBT figures. The issues addressed include secrecy – which initially defined homosexuality – as well as the demonization of the homosexual community with the advent of AIDS, and finally the shift toward acceptance and positivity in the modern era.",72
583,"Nanni Moretti recalls in his diary three slice of life stories characterized by a sharply ironic look: in the first one he wanders through a deserted Rome, in the second he visits a reclusive friend on an island, and in the last he has to grapple with an unknown illness.",74
585,"The original '70s TV family is now placed in the 1990s, where they're even more square and out of place than ever.",62
586,"Eight-year-old Kevin McCallister makes the most of the situation after his family unwittingly leaves him behind when they go on Christmas vacation. But when a pair of bungling burglars set their sights on Kevin's house, the plucky kid stands ready to defend his territory. By planting booby traps galore, adorably mischievous Kevin stands his ground as his frantic mother attempts to race home before Christmas Day.",74
587,"Sam Wheat is a banker, Molly Jensen is an artist, and the two are madly in love. However, when Sam is murdered by his friend and corrupt business partner Carl Bruner over a shady business deal, he is left to roam the earth as a powerless spirit. When he learns of Carl's betrayal, Sam must seek the help of psychic Oda Mae Brown to set things right and protect Molly from Carl and his goons.",72
588,"Princess Jasmine grows tired of being forced to remain in the palace, so she sneaks out into the marketplace, in disguise, where she meets street-urchin Aladdin.  The couple falls in love, although Jasmine may only marry a prince.  After being thrown in jail, Aladdin becomes embroiled in a plot to find a mysterious lamp, with which the evil Jafar hopes to rule the land.",76
589,"Nearly 10 years have passed since Sarah Connor was targeted for termination by a cyborg from the future. Now her son, John, the future leader of the resistance, is the target for a newer, more deadly terminator. Once again, the resistance has managed to send a protector back to attempt to save John and his mother Sarah.",81
590,"Wounded Civil War soldier, John Dunbar tries to commit suicide—and becomes a hero instead. As a reward, he's assigned to his dream post, a remote junction on the Western frontier, and soon makes unlikely friends with the local Sioux tribe.",79
592,"Batman must face his most ruthless nemesis when a deformed madman calling himself ""The Joker"" seizes control of Gotham's criminal underworld.",72
592,"Batman must face his most ruthless nemesis when a deformed madman calling himself ""The Joker"" seizes control of Gotham's criminal underworld.",72
593,"Clarice Starling is a top student at the FBI's training academy.  Jack Crawford wants Clarice to interview Dr. Hannibal Lecter, a brilliant psychiatrist who is also a violent psychopath, serving life behind bars for various acts of murder and cannibalism.  Crawford believes that Lecter may have insight into a case and that Starling, as an attractive young woman, may be just the bait to draw him out.",83
594,"A beautiful girl, Snow White, takes refuge in the forest in the house of seven dwarfs to hide from her stepmother, the wicked Queen. The Queen is jealous because she wants to be known as ""the fairest in the land,"" and Snow White's beauty surpasses her own.",71
595,"Follow the adventures of Belle, a bright young woman who finds herself in the castle of a prince who's been turned into a mysterious beast. With the help of the castle's enchanted staff, Belle soon learns the most important lesson of all -- that true beauty comes from within.",77
595,"Follow the adventures of Belle, a bright young woman who finds herself in the castle of a prince who's been turned into a mysterious beast. With the help of the castle's enchanted staff, Belle soon learns the most important lesson of all -- that true beauty comes from within.",77
596,"Lonely toymaker Geppetto has his wishes answered when the Blue Fairy arrives to bring his wooden puppet Pinocchio to life. Before becoming a real boy, however, Pinocchio must prove he's worthy as he sets off on an adventure with his whistling sidekick and conscience, Jiminy Cricket.",71
596,"Lonely toymaker Geppetto has his wishes answered when the Blue Fairy arrives to bring his wooden puppet Pinocchio to life. Before becoming a real boy, however, Pinocchio must prove he's worthy as he sets off on an adventure with his whistling sidekick and conscience, Jiminy Cricket.",71
597,"When a millionaire wheeler-dealer enters a business contract with a Hollywood hooker Vivian Ward, he loses his heart in the bargain.",74
599,"An aging group of outlaws look for one last big score as the ""traditional"" American West is disappearing around them.",77
