moveId,sinopsis,rating
3196,"It's a dreary Christmas 1944 for the American POWs in Stalag 17 and the men in Barracks 4, all sergeants, have to deal with a grave problem—there seems to be a security leak.",77
3198,"A man befriends a fellow criminal as the two of them begin serving their sentence on a dreadful prison island, which inspires the man to plot his escape.",78
3203,"An Australian couple take a sailing trip in the Pacific to forget about a terrible accident. While on the open sea, in dead calm weather conditions, they come across a ship with one survivor who is not at all what he seems.",66
3200,"Two Navy men are ordered to bring a young offender to prison, but decide to show him one last good time along the way.",71
3201,"A drop-out from upper-class America picks up work along the way on oil-rigs when his life isn't spent in a squalid succession of bars, motels, and other points of interest.",72
3204,Nazi hunter Ezra Lieberman discovers a sinister and bizarre plot to rekindle the Third Reich.,67
3206,"She was a beautiful fugitive. Fleeing from corruption. From power. He was a professional athlete past his prime. Hired to find her, he grew to love her. Love turned to obsession. Obsession turned to murder. And now the price of freedom might be nothing less than their lives.",56
3208,An LA detective is murdered because she has microfilm with the recipe to make cocaine cookies. Two cops partner to find and stop the fiends before they can dope the nation by distributing their wares via the 'Wilderness Girls' cookie drive.,60
3211,"Based on the true story of Lindy Chamberlain who, during a family camping trip to Ayers Rock in central Australia, claimed she witnessed a dingo take her baby daughter, Azaria, from their tent. Azaria's body was never found and, after investigations and two public inquests, she is charged with murder.",68
3213,"When a powerful criminal, who is connected to Bruce Wayne's ex-girlfriend, blames the Dark Knight for killing a crime lord, Batman decides to fight against him.",75
3210,"Based on the real-life adventures chronicled by Cameron Crowe, Fast Times follows a group of high school students growing up in Southern California. Stacy Hamilton and Mark Ratner are looking for a love interest, and are helped along by their older classmates, Linda Barrett and Mike Damone, respectively. At the center of the film is Jeff Spicoli, a perpetually stoned surfer who faces-off with the resolute Mr. Hand—a man convinced that everyone is on dope.",68
3221,A young artist is commissioned by the wife of a wealthy landowner to make a series of drawings of the estate while her husband is away.,71
3219,A couple works hard to renovate their dream house and become landlords to pay for it. Unfortunately one of their tenants has plans of his own.,63
3217,"Esther Blodgett is just another starry-eyed farm kid trying to break into the movies. Waitressing at a Hollywood party, she catches the eye of her idol Norman Maine, is sent for a screen test, and before long attains stardom as newly minted Vicki Lester. She and Norman marry, though his career soon dwindles to nothing due to his chronic alcoholism.",71
3214,"When Dr. Marcus Sommers realizes that he and his troubled, estranged brother David may be prone a fatal brain disease that runs in their family, he decides to make peace with his sibling, and invites him on a trip to the Rockies. There, the brothers bond over their shared enthusiasm for cycling and decide to enter a grueling bike race through the mountains. However, Marcus' health soon begins to fail, and David must compete without his brother at his side.",61
3224,An entomologist suffers extreme psychological and sexual torture after being taken captive by the residents of a poor seaside village.,83
3223,Twin zoologists lose their wives in a car accident and become obsessed with decomposing animals.,73
3225,"College coeds in New York City, Al, the son of a celebrity chef, and Imogen, a talented artist, become smitten the second they lay eyes on one another at a bar. However, the road to happiness is not a smooth one. Outside forces, including a predatory porn star who wants to lure Al into her bed, threaten to pull apart the young lovers before their romance has a chance to really flourish.",52
3230,"After reading the diary of an elderly Jewish man who committed suicide, freelance journalist Peter Miller begins to investigate the alleged sighting of a former SS-Captain who commanded a concentration camp during World War II. Miller eventually finds himself involved with the powerful organisation of former SS members—called ODESSA—as well as with the Israeli secret service. Miller probes deeper and eventually discovers a link between the SS-Captain, ODESSA and his own family.",67
3238,"A reclusive surveillance expert is hired to spy on a mysterious blackmailer, who just may be a serial killer.",50
3235,Semi-biographical film based on the experiences of gonzo journalist Hunter S. Thompson.,59
3243,"High school misfits Stoney and Dave discover a long-frozen primeval man buried in their back yard. But the thawed-out Link—as the boys have named him—quickly becomes a wild card in the teens' already zany southern California lives. After a shave and some new clothes, Link's presence at school makes the daily drudgery a lot more interesting.",58
3240,"Thinking he's competing in Los Angeles' hot Platinum Scissors contest, Scottish hairstylist Crawford (Craig Ferguson) leaves Glasgow with a film crew to capture the event. When he learns he's a mere audience member, Crawford must find a way to become the mane event.",59
3241,"While the soccer World Cup is being played in France, two young Tibetan refugees arrive at a monastery/boarding school in exile in India. Its atmosphere of serene contemplation is disrupted by soccer fever, the chief instigator being a young student, the soccer enthusiast Orgyen who desperately seeks a TV to watch the final.",63
3246,"A tribute to the controversial black activist and leader of the struggle for black liberation. He hit bottom during his imprisonment in the '50s, he became a Black Muslim and then a leader in the Nation of Islam. His assassination in 1965 left a legacy of self-determination and racial pride.",75
3247,"A Reno singer witnesses a mob murder and the cops stash her in a nunnery to protect her from the mob's hitmen. The mother superior does not trust her, and takes steps to limit her influence on the other nuns. Eventually the singer rescues the failing choir and begins helping with community projects, which gets her an interview on TV—and identification by the mob.",68
3248,"Deloris Van Cartier is again asked to don the nun's habit to help a run-down Catholic school, presided over by Mother Superior. And if trying to reach out to a class full of uninterested students wasn't bad enough, the sisters discover that the school is due to be closed by the unscrupulous chief of a local authority.",64
3249,"A suburban family chooses seemingly sweet Peyton Flanders as their newborn's nanny. Only much later does the infant's mother, Claire Bartel, realize Peyton's true intentions -- to destroy Claire and replace her in the family. The nail-biting suspense builds quickly in this chilling psychological thriller about deception and bitter revenge.",69
3250,"The amazing, true story of a Uruguayan rugby team's plane that crashed in the middle of the Andes mountains, and their immense will to survive and pull through alive, forced to do anything and everything they could to stay alive on meager rations and through the freezing cold.",69
3251,"When a dead newborn is found, wrapped in bloody sheets, in the bedroom wastebasket of a young novice, psychiatrist Martha Livingston is called in to determine if the seemingly innocent novice, who knows nothing of sex or birth, is competent enough to stand trial for the murder of the baby.",62
3252,"Charlie Simms is a student at a private preparatory school who comes from a poor family. To earn the money for his flight home to Gresham, Oregon for Christmas, Charlie takes a job over Thanksgiving looking after retired U.S. Army officer Lieutenant Colonel Frank Slade, a cantankerous middle-aged man who lives with his niece and her family.",77
3254,"A message from Jim Morrison in a dream prompts cable access TV stars Wayne and Garth to put on a rock concert, ""Waynestock,"" with Aerosmith as headliners. But amid the preparations, Wayne frets that a record producer is putting the moves on his girlfriend, Cassandra, while Garth handles the advances of mega-babe Honey Hornee.",61
3255,"As America's stock of athletic young men is depleted during World War II, a professional all-female baseball league springs up in the Midwest, funded by publicity-hungry candy maker Walter Harvey. Competitive sisters Dottie Hinson and Kit Keller spar with each other, scout Ernie Capadino and grumpy has-been coach Jimmy Dugan on their way to fame.",72
3253,"The adventures of two amiably aimless metal-head friends, Wayne and Garth. From Wayne's basement, the pair broadcast a talk-show called ""Wayne's World"" on local public access television. The show comes to the attention of a sleazy network executive who wants to produce a big-budget version of ""Wayne's World""—and he also wants Wayne's girlfriend, a rock singer named Cassandra. Wayne and Garth have to battle the executive not only to save their show, but also Cassandra.",67
3256,"When CIA Analyst Jack Ryan interferes with an IRA assassination, a renegade faction targets Jack and his family as revenge.",67
3258,"Madeline is married to Ernest, who was once arch-rival Helen's fiance. After recovering from a mental breakdown, Helen vows to kill Madeline and steal back Ernest. Unfortunately for everyone, the introduction of a magic potion causes things to be a great deal more complicated than a mere murder plot.",68
3257,"A former Secret Service agent grudgingly takes an assignment to protect a pop idol who's threatened by a crazed fan. At first, the safety-obsessed bodyguard and the self-indulgent diva totally clash. But before long, all that tension sparks fireworks of another sort, and the love-averse tough guy is torn between duty and romance.",67
3260,"A saga of class relations and changing times in an Edwardian England on the brink of modernity, the film centers on liberal Margaret Schlegel, who, along with her sister Helen, becomes involved with two couples: wealthy, conservative industrialist Henry Wilcox and his wife Ruth, and the downwardly mobile working-class Leonard Bast and his mistress Jackie.",70
3264,"Blonde, bouncy Buffy is your typical high school cheerleader. But all that changes when a strange man informs her she's been chosen by fate to kill vampires.",56
3266,"The activities of rampaging, indiscriminate serial killer Ben are recorded by a willingly complicit documentary team, who eventually become his accomplices and active participants. Ben provides casual commentary on the nature of his work and arbitrary musings on topics of interest to him, such as music or the conditions of low-income housing, and even goes so far as to introduce the documentary crew to his family. But their reckless indulgences soon get the better of them.",73
3259,"A young man leaves Ireland with his landlord's daughter after some trouble with her father, and they dream of owning land at the big giveaway in Oklahoma ca. 1893. When they get to the new land, they find jobs and begin saving money. The man becomes a local barehands boxer, and rides in glory until he is beaten, then his employers steal all the couple's money and they must fight off starvation in the winter, and try to keep their dream of owning land alive. Meanwhile, the woman's parents find out where she has gone and have come to America to find her and take her back.",67
3267,"El Mariachi just wants to play his guitar and carry on the family tradition. Unfortunately, the town he tries to find work in has another visitor, a killer who carries his guns in a guitar case. The drug lord and his henchmen mistake el Mariachi for the killer, Azul, and chase him around town trying to kill him and get his guitar case.",67
3268,"A tough police sergeant's mother comes to visit him, and promptly starts trying to fix up his life, much to his embarrassment. For his birthday she buys him a machine gun out of the back of a van, and begins to further interfere with his job and love life, eventually helping him with a case he's on.",53
3269,A 1939 test pilot asks his best friend to use him as a guinea pig for a cryogenics experiment. Daniel McCormick wants to be frozen for a year so that he doesn't have to watch his love lying in a coma. The next thing Daniel knows is that he's been awoken in 1992.,64
3270,"Two former Olympians, one a figure skater and the other a hockey player, pin their hopes of one last shot at Olympic glory on one another. That is, of course, if they can keep from killing each other in the process...",72
3271,"Two drifters, one a gentle but slow giant, try to make money working the fields during the Depression so they can fulfill their dreams.",73
3272,"While investigating a young nun's rape, a corrupt New York City police detective, with a serious drug and gambling addiction, tries to change his ways and find forgiveness.",71
3273,"As bodies begin dropping around the set of ‘Stab 3’ — a movie sequel based on the gruesome Woodsboro killings — Sidney, Gale and Dewey are once again drawn into a game of horror movie mayhem.",60
3274,"Attractive Manhattanite Allison Jones has it all: a handsome beau, a rent-controlled apartment, and a promising career as a fashion designer. When boyfriend Sam proves unfaithful, Allison strikes out on her own but must use the classifieds to seek out a roommate in order to keep her spacious digs.",63
3275,"Tired of the crime overrunning the streets of Boston, Irish Catholic twin brothers Conner and Murphy are inspired by their faith to cleanse their hometown of evil with their own brand of zealous vigilante justice. As they hunt down and kill one notorious gangster after another, they become controversial folk heroes in the community. But Paul Smecker, an eccentric FBI agent, is fast closing in on their blood-soaked trail.",73
3276,"Legendary undercover DEA agent Charlie Mayough has suddenly lost his nerves of steel. On the verge of a career-induced mental breakdown, and in complete fear of trigger-happy Mafia leader Fulvio Nesstra, Charlie seeks psychiatric help and finds himself relying on the support of an unstable therapy group and nurse Judy just to get through his work.",53
3280,"A social worker who recently lost her husband investigates the strange Wadsworth family. The Wadsworths might not seem too unusual to hear about them at first - consisting of the mother, two grown daughters and the diaper-clad, bottle-sucking baby. The problem is, the baby is twenty-one years old.",60
3281,"Documentary about Brandon Teena, a transgender man who was murdered along with two others in 1993 in rural Nebraska.",64
3285,"Twenty-something Richard travels to Thailand and finds himself in possession of a strange map. Rumours state that it leads to a solitary beach paradise, a tropical bliss - excited and intrigued, he sets out to find it.",65
3286,"When an entire town in upstate New York is closed down by an unexpected snowfall, a ""snow day"" begins when a group of elementary school kids, led by Natalie Brandston, try to ensure that the schools stay closed by stopping a mechanical snowplow driver by trying to hijack his plow truck. Meanwhile, Natalie's big brother Hal is using this day to try to win the affections of Claire Bonner, the most popular girl in his high school, while Hal and Natalie's father Tom, a TV meteorologist, faces off against a rival meteorologist for weather coverage of the day's events.",51
3283,"Depressed and jaded after being dumped by her married boyfriend, aging beauty Minnie Moore wonders if she'll ever find love.  After shaggy-haired parking lot attendant Seymour Moskowitz comes to her defense from an angry and rebuffed blind date, he falls hopelessly in love with her despite their myriad differences.  Minnie reluctantly agrees to a date with Moskowitz, and, slowly but surely, an unlikely romance blossoms between the two.",68
3284,"Every hero has a weakness, and Sherlock Holmes' weakness was Moriarty. Sherlock Holmes and Dr. Watson solve mysteries and search for Moriarty in 1970s New York City. The fact that Sherlock Holmes is a psychotic paranoid and Dr. Watson is a female psychiatrist fascinated by his case is almost beside the point.",70
3289,"Teacher Gao loves the students in his poor village and is devoted to educating them in the hope of their greater futures. When he is called away to tend to his dying mother for a month, the Mayor calls in an inexperienced 13 year-old replacement, Wei Minzhi; much to Teacher Gao's dismay. Teacher Gao cannot stand the thought of losing anymore students: he has already lost twelve to ever-increasing attrition, and he promises Wei an extra 10 yuan if she succeeds in ensuring that upon his return, there will be not one less. Wei's difficult mission to fulfill Teacher Gao's wish and her own concern for the welfare of the children begins.",74
3294,"A psychotic redneck who owns a dilapidated hotel in the backwater swamps of Louisiana kills various people who upset him or his business, and he feeds their bodies to a large crocodile that he keeps as a pet in the swamp beside his hotel.",54
3295,"Proud, though poor, Bob wants his little girl to have a beautiful (and costly) brand-new dress for her First Communion. His stubbornness and determination get him into trouble as he turns to more and more questionable measures, in his desperation to raise the needed money. This tragic flaw leads him to risk all that he loves and values, his beloved family, indeed even his immortal soul and salvation, in blind pursuit of that goal.",70
3298,A college dropout gets a job as a broker for a suburban investment firm and is on the fast track to success—but the job might not be as legitimate as it sounds.,67
3299,"A trio of sisters bond over their ambivalence toward the approaching death of their curmudgeonly father, to whom none of them was particularly close.",52
3301,"After a mobster agrees to cooperate with an FBI investigation in order to stay out of prison, he's relocated by the authorities to a life of suburban anonymity as part of a witness protection program. It's not long before a couple of his new neighbours figure out his true identity and come knocking to see if he'd be up for one more hit—suburban style.",64
3300,"When their ship crash-lands on a remote planet, the marooned passengers soon learn that escaped convict Riddick isn't the only thing they have to fear. Deadly creatures lurk in the shadows, waiting to attack in the dark, and the planet is rapidly plunging into the utter blackness of a total eclipse. With the body count rising, the doomed survivors are forced to turn to Riddick with his eerie eyes to guide them through the darkness to safety. With time running out, there's only one rule: Stay in the light.",68
3302,"In London, during October 1993, England is playing Holland in the preliminaries of the World Cup. The Bosnian War is at its height, and refugees from the ex-Yugoslavia are arriving. Football rivals, and political adversaries from the Balkans all precipitate conflict and amusing situations. Meanwhile, the lives of four English families are affected in different ways by encounter with the refugees.",59
3296,"A British Guianese engineer starts a job as a high school teacher in London’s East End, where his uninterested and delinquent pupils are in desperate need of attention and care.",75
3306,"Charlie, a wandering tramp, becomes a circus handyman - soon the star of the show - and falls in love with the circus owner's stepdaughter.",80
3303,"The film follows a simple structure, and shows the drug-related degradation of five youths (Jake, Tracey, Jessica, Alice, Oreo) during the course of three years. The film depicts drug-related crimes and diseases: prostitution, male prostitution, AIDS, and lethal overdoses.",68
3307,"In this sound-era silent film, a tramp falls in love with a beautiful blind flower seller.",83
3308,"Brooklyn teenager Jeffrey Willis, thoroughly unhappy with his modest homestead, embraces the other-world aspects of his summer job at the posh Flamingo Club. He spurns his father in favor of the patronage of smooth-talking Phil Brody and is seduced by the ample bikini charms of club member Carla Samson. But thanks to a couple of late-summer hard lessons, the teen eventually realizes that family should always come first.",62
3310,A tramp cares for a boy after he's abandoned as a newborn by his mother. Later the mother has a change of heart and aches to be reunited with her son.,82
3313,"Lizzie Borden High's class of '72 are going through the motions at their tenth-year reunion, until deranged alum Walter Baylor, driven insane by a sadistic senior-year prank, escapes from the mental institution and crashes the party. When guests start getting bumped off, the other alumni, including snooty yacht salesman Bob Spinnaker, class tease Bunny Packard, and class zero Gary Nash, spring into action to uncover the culprit.",52
3315,"B.G. Bruno, a rich bachelor, the head of a successful greeting-card company in Scotland, is essentially a kind man but respectable to the point of stodginess and extreme stuffiness. An American troupe visiting Edinburgh wants to produce a musical in town but has trouble getting backers. Bruno meets several of the leading ladies of the show; through a misunderstanding he doesn't correct they think that he's a newspaper reporter. He falls in love with one of the women, who reciprocates; he grows more lively and friendly, to the surprise of his employees. After a series of mishaps and comic incidents comes a happy ending: a successful show and true love.",60
3316,"After assuming his dead cellmate's identity to get with his girlfriend, an ex-con finds himself the reluctant participant in a casino heist.",56
3317,Grady is a 50-ish English professor who hasn't had a thing published in years—not since he wrote his award winning 'Great American Novel' 7 years ago. This weekend proves even worse than he could imagine as he finds himself reeling from one misadventure to another in the company of a new wonder boy author.,68
3323,An avid detective is assigned to investigate the heist of a batch of precious coins that end up in the hands of a suicidal barber.,57
3328,"An African-American Mafia hit man who models himself after the samurai of old finds himself targeted for death by the mob. Jarmusch's spiritual gangster film tells the story of an inner-city hit man (Whitaker) who lives on a rooftop, training himself as a samurai in the strictest sense. He communicates primarily by carrier pigeon, while remaining loyal to a gangster (Tormey) who once saved his life.",73
3325,"A comedy-drama about best friends - one a straight woman, Abbie, the other a gay man, Robert - who decide to have a child together. Five years later, Abbie falls in love with a straight man and wants to move away with her and Robert's little boy Sam, and a nasty custody battle ensues.",52
3329,"Set in 1962, a young prepubescent boy in rural Australia watches painfully as his best friend and first love blossoms into womanhood and falls for a thuggish rugby player, changing the lives of everyone involved.",72
3330,A fragile Kansas girl's unrequited and forbidden love for a handsome young man from the town's most powerful family drives her to heartbreak and madness.,76
3324,"The recently deceased Mona Dearly was many things: an abusive wife, a domineering mother, a loud-mouthed neighbor and a violent malcontent. So when her car and corpse are discovered in the Hudson River, police Chief Wyatt Rash immediately suspects murder rather than an accident. But, since the whole community of Verplanck, N.Y., shares a deep hatred for this unceasingly spiteful woman, Rash finds his murder investigation overwhelmed with potential suspects.",56
3331,"High school senior Bobby Chrystal fails his French class, which will block him from entering Yale. His rich, authoritarian father hires an attractive 29-year-old to tutor Bobby over the summer and help him pass a make-up exam. While Bobby's friends lead him away into strange excursions aimed at losing their virginity, Bobby finds all the extracurricular activities he needs with his new tutor.",50
3338,"A testament to NASA's Apollo program of the 1960s and '70s. Composed of actual NASA footage of the missions and astronaut interviews, the documentary offers the viewpoint of the individuals who braved the remarkable journey to the moon and back.",79
3334,"A hurricane swells outside, but it's nothing compared to the storm within the hotel at Key Largo. There, sadistic mobster Johnny Rocco holes up - and holds at gunpoint hotel owner James Temple, his widowed daughter-in-law Nora, and ex-GI Frank McCloud.",75
3342,"Two young men are seriously affected by the Vietnam war. One of them has always been obsessed with birds - but now believes he really is a bird, and has been sent to a mental hospital. Can his friend help him pull through?",71
3344,"In the sleepy suburbs of Miami, seemingly normal Egyptian immigrant Fuad Ramses (Mal Arnold) runs a successful catering business. He also murders young women and plans to use their body parts to revive the goddess Ishtar. The insane Ramses hypnotizes a socialite in order to land a job catering a party for her debutante daughter, Suzette Fremont (Connie Mason), and turns the event into an evening of gruesome deaths, bloody dismemberment and ritual sacrifice.",47
