moveId,sinopsis,rating
3882,"The Toro cheerleading squad from Rancho Carne High School in San Diego has got spirit, spunk, sass and a killer routine that's sure to land them the national championship trophy for the sixth year in a row. But for newly-elected team captain Torrance, the Toros' road to total cheer glory takes a shady turn when she discovers that their perfectly-choreographed routines were in fact stolen.",62
3888,A woman and her son must leave a small South Carolina town because of her wild behavior.,60
3884,Four retired mobsters plan one last crime to save their retirement home.,55
3889,"Immortals Connor and Duncan Macleod join forces against a man from Connor's distant past in the highlands of Scotland, Kell, an immensely powerful immortal who leads an army of equally powerful and deadly immortal swordsmen and assassins. No immortal alive has been able to defeat Kell yet, and neither Connor nor Duncan are skilled enough themselves to take him on and live. The two of them eventually come to one inevitable conclusion; one of them must die so that the combined power of both the Highlanders can bring down Kell for good. There can be only one... the question is, who will it be?",48
3893,"What happens when a person decides that life is merely a state of mind? If you're Betty, a small-town waitress and soap opera fan from Fair Oaks, Kansas, you refuse to believe that you can't be with the love of your life just because he doesn't really exist. After all, life is no excuse for not living. Traumatized by a savage event, Betty enters into a fugue state that allows -- even encourages -- her to keep functioning... in a kind of alternate reality.",59
3894,"Maria, whose parents live in the country, cannot stand her father's authoritarian ways and moves to the city. She finds a job as a cleaner and tries to survive in a wretched apartment in the shabby part of a big city. She is pregnant, and the fact that her boyfriend has abandoned her does not help matters. When her father goes to the hospital for an operation, her mother comes to stay with her. Her neighbor, an old recluse whose only friend is his dog, begins to come out of his shell and these three lost souls try to give each other the strength to start over.",70
3900,"At school, Roseanne is the object of fellow student Vincent's infatuation. By night, she deals with a troubled family life: her mother, Maggie, cheats on her drunken husband, Fred. When Maggie's adultery is revealed, Fred viciously takes his anger out on stepdaughter Roseanne. With the help of her boyfriend, Jimmy, Maggie plots her revenge, but Vincent might be the one to help her forge a new life in this contemporary fable loosely based on Fyodor Dostoyevsky's ""Crime and Punishment"".",62
3896,Two criminal drifters without sympathy get more than they bargained for after kidnapping and holding for ransom the surrogate mother of a powerful and shady man.,64
3895,"FBI agent Joel Campbell, burnt-out and shell-shocked after years spent chasing serial killers, flees L.A. to begin a new life for himself in Chicago. But five months later, Joel's best laid plans are abruptly cut short when his new hometown becomes the setting for some particularly gruesome murders--murders that could only have been committed by one man: David Allen Griffin. One of Joel's most elusive and cunning nemeses, Griffin has followed his former pursuer to Chicago in order to play a sadistic game of cat and mouse. Taunting Joel with photographs of his intended victims and leaving his crime scenes meticulously free of clues in order to keep the police at bay, Griffin derives as much pleasure out of watching Joel react to every movement as watching his victims die. But when Griffin moves into Joel's inner circle, Joel must quickly find some way to stop him before someone close to him becomes the next one to die.",50
3897,"In 1973, 15-year-old William Miller's unabashed love of music and aspiration to become a rock journalist lands him an assignment from Rolling Stone magazine to interview and tour with the up-and-coming band, Stillwater.",75
3898,"Landing in jail for a petty theft crime, Alvin finds himself sharing a cell with John Jaster, the incarcerated half of the pair of high-tech thieves responsible for the missing gold. His partner, Bristol, is still at large. Alvin wants only to get out of prison and start fresh with his girlfriend, Lisa, and when the Feds, led by U.S. Treasury investigator Clenteen, set him loose on a sketchy deal, he thinks his luck has changed. Alvin has his freedom and the Feds have found their bait.",57
3901,"Duets is a road-trip comedy which revolves around the little known world of karaoke and the whimsical characters who inhabit it. All roads lead to Omaha, site of a national karaoke competition where this motley group of singers and stars come together for a blow-out sing-off.",58
3899,"Bruno, a sadistic criminal, wants clever con man Leo out of the way. Leo and his equally clever wife, Lily, are up to something. So too is Julius: he hires Leo to kill Gloria, Julius's wife. Leo does it, but then Julius shows up with the murder on tape, saying Gloria isn't his wife - it's blackmail. Leo's bookie, Troy, is also closing in, wanting to be paid. Bruno and Lily as well as Bruno and Julius have their own scams running, and Leo is their target. Maybe Leo can get Troy off his back, avoid Moose (Bruno's huge enforcer), send Gloria's corpse out of England, turn the tables on Bruno's murderous brother Caspar, and outfox Lily. Or is Lily his fox? It's a three-ring circus.",49
3906,"A lawyer is asked to come to the police station to clear up a few loose ends in his witness report of a foul murder. ""This will only take ten minutes"", they say, but it turns out to be one loose end after another, and the ten minutes he is away from his speech become longer and longer.",61
3908,"The making of a horror movie takes on a terrifying reality for students at the most prestigious film school in the country. At Alpine University, someone is determined to win the best film award at any cost - even if it means eliminating the competition. No one is safe and everyone is a suspect.",48
3909,"Set to the intoxicating rhythms of Brazil, ""Woman on Top"" is a spicy, sexy comedy about the magic of food, love and music. Meet Isabella, a sultry enchantress born with the special gift of melting the palates and hearts of men everywhere. When she decides to break free from her rocky marriage and the stifling kitchen of her husband's restaurant in Brazil, she spirits off to San Francisco in pursuit of her dreams of a real culinary career.",63
3910,"Selma, a Czech immigrant on the verge of blindness, struggles to make ends meet for herself and her son, who has inherited the same genetic disorder and will suffer the same fate without an expensive operation. When life gets too difficult, Selma learns to cope through her love of musicals, escaping life's troubles - even if just for a moment - by dreaming up little numbers to the rhythmic beats of her surroundings.",79
3912,"Determined to win the Miss American Miss pageant, Mona is ready to sacrifice anything and everything to guarantee herself the crown including her own daughter! She manages to persuade her best bud to raise the kid as her own (Miss AM can't be a mom), but just when this beauty-queen wannabe thinks her prize is in sight, she's surprised by a come-from-behind competitor. Love.",57
3911,"The tension is palpable, the excitement is mounting and the heady scent of competition is in the air as hundreds of eager contestants from across America prepare to take part in what is undoubtedly one of the greatest events of their lives -- the Mayflower Dog Show. The canine contestants and their owners are as wondrously diverse as the great country that has bred them.",70
3915,"Diana Guzman begins to train as a boxer and achieves impressive success, blazing new trails for female boxers, all while keeping it a secret from her father.",62
3914,"A close-knit group of gay friends share the emotional roller coster of life, relationships, the death of friends, new beginnings, jealousy, fatherhood and professional success. At various stages of life's disarray, these young men share humorous and tragic relationships and always have each other to rely on.",65
3916,"After leading his football team to 15 winning seasons, coach Bill Yoast is demoted and replaced by Herman Boone – tough, opinionated and as different from the beloved Yoast as he could be. The two men learn to overcome their differences and turn a group of hostile young men into champions.",76
3917,"After tinkering with a box he bought while abroad, sexual deviant Frank inadvertently opens a portal to hell, where fetish-demons led by Pinhead tear his body apart. When Frank’s brother and his wife move into his house, a skeletal Frank appears to his sister-in-law and asks her to supply him with corpses for his regeneration.",69
3918,"Doctor Channard is sent a new patient, a girl warning of the terrible creatures that have destroyed her family, Cenobites who offer the most intense sensations of pleasure and pain. But Channard has been searching for the doorway to Hell for years, and Kirsty must follow him to save her father and witness the power struggles among the newly damned.",64
3919,"Pinhead is trapped in the Pillar of Souls. Fortunately for him it is bought by a young playboy who owns his own nightclub. Pinhead busies himself escaping by getting the playboy to lure victims to his presence so he can use their blood. Once free, he seeks to destroy the puzzle box so he need never return to Hell, but a female reporter is investigating the grisly murders and stands in his way.",57
3920,"Damiel is now married to Marion, runs the pizzeria “Da Angelo” and the two have a child. The solitarily remaining angel Cassiel is more and more dissatisfied with his destiny as a mere observer of human life and finally decides to take the great leap. As Karl Engel he soon gets into a dubious milieu and finds himself as the assistant of the German American Baker, who makes his money with shady arms deals and sends porno films east in exchange for weapons. Cassiel’s adventure turns into a “thriller” when he decides to put a stop to Baker’s game.",68
3926,The crew of an atomic submarine battle to save the world from global destruction.,58
3922,"A millionaire sets out to prove his theory that his pet chimpanzee is as intelligent as the teenagers who hang out on the local beach, where he is intending to build a retirement home.",62
3928,"Two hapless freight handlers find themselves encountering Dracula, the Frankenstein Monster and the Wolf Man.",71
3927,"In order to save an assassinated scientist, a submarine and its crew are shrunk to microscopic size and injected into his bloodstream.",67
3929,"Egbert Sousé becomes an unexpected hero when a bank robber falls over a bench he's occupying. Now considered brave, Egbert is given a job as a bank guard. Soon, he is approached by charlatan J. Frothingham Waterbury about buying shares in a mining company. Egbert persuades teller Og Oggilby to lend him bank money, to be returned when the scheme pays off. Unfortunately, bank inspector Snoopington then makes a surprise appearance.",64
3930,"When scientists exploring the Amazon River stumble on a “missing link” connecting humans and fish, they plan to capture it for later study. But the Creature has plans of his own, and has set his sights on the lead scientist's beautiful fiancée, Kay.",69
3932,"Working in Dr. Cranley’s laboratory, scientist Jack Griffin was always given the latitude to conduct some of his own experiments. His sudden departure, however, has Cranley’s daughter Flora worried about him. Griffin has taken a room at the nearby Lion’s Head Inn, hoping to reverse an experiment he conducted on himself that made him invisible. But the experimental drug has also warped his mind, making him aggressive and dangerous. He’s prepared to do whatever it takes to restore his appearance.",75
3937,"In the near future, a police officer specializes in malfunctioning robots. When a robot turns out to have been programmed to kill, he begins to uncover a homicidal plot to create killer robots... and his son becomes a target.",55
3938,"An 18-year-old high school girl is left at home by her parents and decides to have a slumber party. Meanwhile, a mass murderer with a propensity for power tools has escaped from prison, and eventually makes his way to the party where the guests begin dropping off one by one.",56
3933,"Trapped on a remote island by a hurricane, a group discover a doctor has been experimenting on creating half sized humans. Unfortunately, his experiments have also created giant shrews, who when they have run out of small animals to eat, turn on the humans....",43
3939,"Courtney, the younger sister of Valerie, and her friends go to their condo for a weekend getaway, but Courtney can't get rid of the haunting feeling that a supernatural rockabilly driller killer is coming to murder them all.",51
3940,"After a hard day of volleyball at the beach, a teen whose parents are away decides to have a slumber party with her girlfriends. Their boyfriends predictably show up to scare them, but a stranger from the beach is also seen lurking around the house. Soon the group begins experiencing an attrition problem.",50
3942,"Five college women buy the old Hokstedter place for their new sorority house. They got it cheap because of the bloody incidents from five years before. They decide to stay in it for the night so they can meet the movers in the morning, but begin to get the creeps when the weird neighbor Orville Ketchum starts poking around. Shortly after the women take showers and consult a Ouija board they begin experiencing an attrition problem.",55
3941,College student Beth and her sorority sisters are stalked by an escaped psychopathic killer who shares a strange telepathic link with her.,46
3945,"The first story focused on Tai and Kari Kamiya four years before their adventure in the Digital World. It shows their first encounter with Digimon and what happened to them (as well as the other children). Tai and Kari wake one morning to find a Digi-Egg that came out of their computer the night before and the egg soon hatches, revealing a Botamon. The Digimon then evolves into Koromon and then Agumon (not the same one that became friends with Tai in the series, and yet, somehow, both Koromon and Kari remember each other), who then goes out and unintentionally destroys a good part of the neighborhood with Kari riding on his back. A second Digi-Egg appears in the sky to reveal an evil digimon, Parrotmon. Agumon then Digivolves to Greymon but isn't strong enough to beat Parrotmon and is knocked out. Tai grabs Kari's whistle and wakes up Greymon, who defeats Parrotmon and disappears with him.",66
3946,"Jack Carter, a mob enforcer living in Las Vegas, travels back to his hometown of Seattle for his brother's funeral. During this visit, Carter realizes that the death of his brother was not accidental, but a murder. With this knowledge, Carter sets out to kill all those responsible.",51
3946,"Jack Carter, a mob enforcer living in Las Vegas, travels back to his hometown of Seattle for his brother's funeral. During this visit, Carter realizes that the death of his brother was not accidental, but a murder. With this knowledge, Carter sets out to kill all those responsible.",51
3948,"Greg Focker is ready to marry his girlfriend, Pam, but before he pops the question, he must win over her formidable father, humorless former CIA agent Jack Byrnes, at the wedding of Pam's sister. As Greg bends over backward to make a good impression, his visit to the Byrnes home turns into a hilarious series of disasters, and everything that can go wrong does, all under Jack's critical, hawklike gaze.",67
3949,The hopes and dreams of four ambitious people are shattered when their drug addictions begin spiraling out of control. A look into addiction and how it overcomes the mind and body.,80
3951,"Buddy Visalo (Michael Rispoli) is a factory worker, a frustrated crooner who once had a shot at the big time. Buddy's dreams of greatness have been reduced to an endless series of failed moneymaking schemes. His latest is buying a two-family house for him and his wife, Estelle (Katherine Narducci) and converting the ground floor into a neighborhood bar where he can perform. The wrench in the works is that he also inherits the upstairs tenants, Mary,a pregnant Irish girl fresh off the boat (Kelly Macdonald) and her abusive, alcoholic husband, Jim (Kevin Conway). As Buddy's gang of Italians tries to handle the situation, the girl goes into labor, and a baby is born, forcing them all to confront the limits of their tolerance and compassion.",72
3953,"A successful Texas gynecologist finds himself amid a bevy of women and their problems – his wife’s breakdown, his daughter's fake marriage, his other daughter’s conspiracy theories, and his secretary’s crush. Craving time for himself, he finds solace in a kind outsider.",49
3952,"The vice president is dead, and as the president makes his choice for a replacement, a secret contest of wills is being waged by a formidable rival. When Senator Laine Hanson is nominated as the first woman in history to hold the office, hidden agendas explode into a battle for power.",67
3950,"A group of recruits go through Advanced Infantry Training at Fort Polk, Louisiana's infamous Tigerland, last stop before Vietnam for tens of thousands of young men in 1971.",66
3955,"Because of his salacious language, late-night radio advice-show host Leon Phelps, along with his sweet and loyal producer Julie, is fired from his Chicago gig. Leon gets a letter from a former lover promising a life of wealth, but he doesn't know who she is. Can Leon find his secret sugar-mama? What about Julie?",53
3958,"After a senator suddenly dies after completing (and sealing) an investigation into the nuclear power industry, the remaining senator and the state governor must decide on a person who will play along with their shady deals and not cause any problems. They decide on Billy Jack, currently sitting in prison after being sent to jail at the end of his previous film, as they don't expect him to be capable of much, and they think he will attract young voters to the party.",64
3963,"The buoyant Molly Brown has survived the first crisis of her life—a flood. Sixteen years later she sets out to make her way in the world. She assures the Leadville saloon keeper that she can sing and play the piano, and learns quickly. Soon she marries Johnny Brown, who in a few years will be able to replace the original cigar wrapper wedding ring with a replica in gold and gemstones. The Browns head for Europe and bring a few crowned heads back to Denver for a party that turns into a ballroom brawl. Molly goes to Europe alone, returning on the Titanic. She didn't survive a flood as a baby for the story to end here.",56
3957,"Ex-Green Beret hapkido expert saves wild horses from being slaughtered for dog food and helps protect a desert ""freedom school"" for runaways.",61
3964,"The Wind in the Willows: Concise version of Kenneth Grahame's story of the same name. J. Thaddeus Toad, owner of Toad Hall, is prone to fads, such as the newfangled motor car. This desire for the very latest lands him in much trouble with the wrong crowd, and it is up to his friends, Mole, Rat and Badger to save him from himself. - The Legend of Sleepy Hollow: Retelling of Washington Irving's story set in a tiny New England town. Ichabod Crane, the new schoolmaster, falls for the town beauty, Katrina Van Tassel, and the town Bully Brom Bones decides that he is a little too successful and needs ""convincing"" that Katrina is not for him.",65
3965,"Three childhood friends, Martha, Walter and Sam, share a terrible secret. Over time, the ambitious Martha and the pusillanimous Walter have married. She is a cold businesswoman; he is the district attorney: a perfect combination to dominate the corrupt city of Iverstown at will. But the unexpected return of Sam, after years of absence, deeply disturbs the life of the odd couple.",71
3962,"Ghoulies II picks up a short time after the first movie, a few of the little nasties stow away on an amusement park ride and bring big bucks to a dying fair. The creatures are mad after an attempt to kill them, so the creatures go on a rampage through the fairgrounds, ultimately leading to an explosive conclusion!",52
3967,County Durham England 1984 the miners strike has started and the police have started coming up from Bethnal Green starting a class war with the lower classes suffering caught in the middle of the conflict is 11-year old Billy Elliot who after leaving his boxing club for the day stubbles upon a ballet class and finds out that he's naturally talented. He practices with his teacher Mrs Wilkinson for an upcoming audition in Newcastle-upon Tyne the audition is for the royal Ballet school in London.,76
3968,"Elliot Richardson, a suicidal techno geek, is given seven wishes to turn his life around when he meets a very seductive Satan. The catch: his soul. Some of his wishes include a 7 foot basketball star, a rock star, and a hamburger. But, as could be expected, the Devil puts her own little twist on each of his fantasies.",60
3969,"Like some other kids, 12-year-old Trevor McKinney believed in the goodness of human nature. Like many other kids, he was determined to change the world for the better. Unlike most other kids, he succeeded.",73
3972,"Returning home with his father after a shopping expedition, Wong Fei-Hong is unwittingly caught up in the battle between foreigners who wish to export ancient Chinese artifacts and loyalists who don't want the pieces to leave the country. Fei-Hong must fight against the foreigners using his Drunken Boxing style, and overcome his father's antagonism as well.",74
3973,"Young adults become fascinated by the events of the three missing filmmakers in Maryland, so they decide to go into the same woods and find out what really happened.",42
3974,"Based on the popular books, the story tells of Tony who wants a friend to add some adventure to his life. What he gets is Rudolph, a vampire kid with a good appetite. The two end up inseparable, but their fun is cut short when all the hopes of the vampire race could be gone forever in single night. With Tony's access to the daytime world, he helps them to find what they've always wanted.",68
3977,"The captivating crime-fighting trio who are masters of disguise, espionage and martial arts are back! When a devious mastermind embroils them in a plot to destroy individual privacy, the Angels, aided by their loyal sidekick Bosley, set out to bring down the bad guys. But when a terrible secret is revealed, it makes the Angels targets for assassination.",58
3979,"After the lord of darkness decides he will not cede his throne to any of his three sons, the two most powerful of them escape to Earth to create a kingdom for themselves. This action closes the portal filtering sinful souls to Hell and causes Satan to wither away. He must send his most weak but beloved son, Little Nicky, to Earth to return his brothers to Hell.",59
3978,"World War I has left golfer Rannulph Junuh a poker-playing alcoholic, his perfect swing gone. Now, however, he needs to get it back to play in a tournament to save the financially ravaged golf course of a long-ago sweetheart. Help arrives in the form of mysterious caddy Bagger Vance.",65
3980,"Against formidable odds -- and an old-school diving instructor embittered by the U.S. Navy's new, less prejudicial policies -- Carl Brashear sets his sights on becoming the Navy's first African-American master diver in this uplifting true story. Their relationship starts out on the rocks, but fate ultimately conspires to bring the men together into a setting of mutual respect, triumph and honor.",74
3981,"Astronauts search for solutions to save a dying Earth by searching on Mars, only to have the mission go terribly awry.",57
3983,"A single mother's life is thrown into turmoil after her struggling, rarely-seen younger brother returns to town.",69
3984,Diamonds are stolen only to be sold again in the international market. James Bond infiltrates a smuggling mission to find out who's guilty. The mission takes him to Las Vegas where Bond meets his archenemy Blofeld.,64
3985,"When the Nazi high command learns in late 1943 that Winston Churchill will be spending time at a country estate in Norfolk, it hatches an audacious scheme to kidnap the prime minister and spirit him to Germany for enforced negotiations with Hitler.",66
3986,"A world of the very near future in which cattle, fish, and even the family pet can be cloned. But cloning humans is illegal - that is until family man Adam Gibson (Arnold Schwarzenegger) comes home from work one day to find a clone has replaced him. Taken from his family and plunged into a sinister world he doesn't understand, Gibson must not only save himself from the assassins who must destroy him to protect their secret, but uncover who and what is behind the horrible things happening to him.",59
3988,The Grinch decides to rob Whoville of Christmas - but a dash of kindness from little Cindy Lou Who and her family may be enough to melt his heart...,67
3987,A man switches plane tickets with another man who dies in that plane in a crash. The man falls in love with the deceased one's wife.,57
3990,"A group of rambunctious toddlers travel a trip to Paris. As they journey from the Eiffel Tower to Notre Dame, they learn new lessons about trust, loyalty and love.",66
